,Artist,Album,Release Date,Lyrics
​anything,Adrianne Lenker,songs,"{'year': 2020, 'month': 9, 'day': 2}","Staring down the barrel of the hot sun
Shining with the sheen of a shotgun Shotgun)
Carol has a little if we need some
Joa has a ride if we wanna come
Hanging your jeans with a clothespin
Skin still wet, still on my skin
Mango in your mouth, juice drippin'
Shoulder of your shirt sleeve slippin'

Christmas Eve with your mother and sis
Don't wanna fight but your mother insists
Dog's white teeth slice right through my fist
Drive to the ER and they put me on risk
Grocery store list, now you get pissed
Unchecked calls and messages
I don't wanna be the owner of your fantasy
I just wanna be a part of your family

And I don't wanna talk about anything
I don't wanna talk about anything
I wanna kiss, kiss your eyes again
Wanna witness your eyes looking
I don't wanna talk about anyonе
I don't wanna talk about anyone
I wanna sleep in your car while you're driving
Lay in your lap whеn I'm crying
 
Circle of pine and red oak
Circle of moss and fire smoke
Fan on the ceiling like a wheel spoke
Push the clutch and I pull the choke
Wanna listen to the sound of you blinking
Wanna listen to your hands soothe
Listen to your heart beating
Listen to the way you move

And I don't wanna talk about anything
I don't wanna talk about anything
I wanna kiss, kiss your eyes again
Wanna witness your eyes looking
I don't wanna talk about anyone
I don't wanna talk about anyone
I wanna sleep in your car while you're driving
Lay in your lap when I'm crying

Weren't we the stars in Heaven?
Weren't we the salt in the sea?
Dragon in the new warm mountain
Didn't you believe in me?
You held me the whole way through
But I couldn't say the words like you
I was scared, Indigo, but I wanted to
I was scared, Indigo, but I wanted to
And I don't wanna talk about anything
I don't wanna talk about anything
I wanna kiss, kiss your eyes again
Wanna witness your eyes looking
I don't wanna talk about anyone
I don't wanna talk about anyone
I wanna sleep in your car while you're driving
Lay in your lap when I'm crying"
"​not a lot, just forever",Adrianne Lenker,songs,"{'year': 2020, 'month': 10, 'day': 23}","Through your eyes I see
A smile you bring to me
To your joy I tether

Not a lot, just forever
Intertwined sewn together
Like the rock bears the weather
Not a lot, just forever

My dog barks wildly
To protect my infancy
From my exbeliever
And I try to calm the wolf
To remind her I am both
Still she tears at my sweater

Not a lot, just forever
Intertwined, sewn together
As the wren sheds her feather
Not a lot, just forever

And your dearest fantasy
Is to grow a baby in me
I could be a good mother
And I wanna be your wife
So I hold you to my knife
And I steal your letter
 
Not a lot, just forever
Intertwine some together
As the rock bears the weather
Not a lot, just forever

So I bash around the house
And the poison stains my mouth
She comes, I let her
And we share a paradise
And I roll them once or twice
Can't get much better

Not a lot, just forever
Intertwined sewn together
As the rock bears the weather
Not a lot, just forever
Not a lot, just forever
Intertwined, sewn together
As the wren bares her feathers
Not a lot, just forever"
​ingydar,Adrianne Lenker,songs,"{'year': 2020, 'month': 10, 'day': 23}","Fragilely, gradually and surrounding
The horse lies naked in the shed
Evergreen anodyne decompounding
Flies draw sugar from his head

His eyes are blueberries, video screens, Minneapolis schemes
And the dried flowers from books halfread
The juice of dark cherries cover his chin
The dog walks in and the crow lies in his jaw like lead

Everything eats and is eaten
Time is fed

Early еvening, the pink ring swallows
The sphеrical marigold terrain
Sleepily, Venus sinks and hollows
The stationed headlight of a plane

You are as far from me as memory
With fixtures fracture varyingly
The juice of dark cherries cover my skin
Six years in, no baby
 
Everything eats and is eaten

Ingydar bares a scar like a meteor
Crystalline amber guilds her cheek
Tambourine of the beech leaves lead her
To the raven playing hide and seek

Drying blueberries, figurines
And the angel leans at the head of the bed
The juice of dark cherries cover her chin
The dog walks in and the crow lies in his smile like lead

Everything eats and is eaten, time is fed
Everything eats and is eaten
Everything eats and is eaten
Everything eats and is eaten
Everything eats and is eaten
Everything eats and is eaten"
Sadness As a Gift,Adrianne Lenker,Bright Future,"{'year': 2024, 'month': 1, 'day': 17}","Two
And one, two, three, four

You and I both know
There is nothing more to say
Chance has shut her shining eyes
And turned her face away

Leaning on the windowsill
You could write me someday, and I think you will
We could see the sadness as a gift and still
Feel too heavy to hold

Snow fallin'
I try to keep from callin'
Watch the spring turn to winter
Fireflies all frozen

The seasons go so fast
Thinking that this one was gonna last
Maybe the question was too much to ask
 
Been searching for your eyes
All I see is blue skies
And that old man beats his crooked cane
It's time to let go

Leaning on the windowsill
You could write me someday, and I bet you will
We could see the sadness as a gift and still
The seasons go so fast
Thinking that this one was gonna last
Maybe the question was too much to ask

You and I could see into the same eternity
Every second brimming with a majesty

Oh, kiss so sweet, so fine
You could hear the music inside my mind
And you showed me a place
I'll find even when I'm old
Just leaning on the windowsill
You could write me someday, and I hope you will
We could see the sadness as a gift and still
The seasons go so fast
Thinking that this one was gonna last
Maybe the question was too much to ask"
​zombie girl,Adrianne Lenker,songs,"{'year': 2020, 'month': 10, 'day': 23}","What a dream that was
I almost couldn't wake because
I was frozen in bed with a zombie girl
Vacant as a closed down fair

Sleep paralysis, I sworn I couldve felt you there
And I almost could've kissed your hair
But the emptiness withdrew me
From any kind of wishful prayer

Oh, emptiness
Tell me 'bout your nature
Maybe Ive been getting you wrong
I cover you with questions
Cover you with explanations
Cover you with music

Then the next night
Dreaming I could feel your skin
But the dream escaped so easily
And I wokе up to the road again
 
How your words ring through
Something kinda sweet and blue
And I knеw that you'd been understanding
Everything that I'd said, too

About emptiness
Tell me 'bout your nature
Maybe I've been getting you wrong
I cover you with questions
Cover you with explanations
Cover you with music

What's on your mind?
What's on your mind?
What's on your mind?
Whats on your mind?
In your mind"
​two reverse,Adrianne Lenker,songs,"{'year': 2020, 'month': 10, 'day': 23}","Lay me down so
To let you leave
Tell me lies
I wanna see your eyes
Is it a crime to say
I still need you?
Crime, wanna feed you

Light blue, dark blue, grey
Crimson trail
Straight through, stay don't stray

Grandmother, Juniper
Tell to me your recipe
Is it a cry I hear
From the deep wood?
Crying, reappear from
The weeds

Light blue, dark blue, grey
Crimson trail
Straight through, stay don't stray
 
Through the jail
See the sun
Flat as a knife
Cold and white
To my home, two rivers
Through my home, two reverse
Is it a crime to do
What you ask me to?
Crime"
​symbol,Adrianne Lenker,abysskiss,"{'year': 2018, 'month': 9, 'day': 12}","Fly make flea, make haste, make waste, eight makes infinity
Times I've tried to make breaks, embrace for the enemy
Meet my face to face, time try to find the diamond
Counting time as time counts me, the river to the island

Do you not, do you not tell?
That smile always makes me well
Do you see circling through?
That's how one returns from two

Fly make flea, make haste, make taste, eight makes infinity
Times I've tried to make breaks, embrace for the enemy
Meet my face to face, time try to find the diamond
Counting time as time counts me, the river to the island

Do you not, do you not tell?
That smile always makes me well
Do you see circling through?
That's how one returns from two

The symbol of your love is time
The symbol of your love is time
 
Do you not, do you not tell?
That smile always makes me well
Do you see circling through?
That's how one returns from two
Do you not, do you not tell?
That smile always makes me well
Do you see circling through?
That's how one returns from two"
Real House,Adrianne Lenker,Bright Future,"{'year': 2024, 'month': 3, 'day': 22}","Do you remember running?
The purity of the air around
Braiding willow branches into a crown
That love is all I want

I'm a child humming
Into the clarity of black space
Where stars shine like tears on the night's face
With a cool wind

Mama, what happened?
I never thought we'd go this long
Now, thirtyone and I don't feel strong
And your love is all I want

When I was seven
I saw the first film that made me scared
And I thought of this whole world ending
I thought of dying unprepared

We moved into a real house
A wild field behind it
I wanted to be an inventor
Collected scraps to make a portal
I wanted so much for magic to be real
 
So many dreams of flying
Rising high over the crowd
And they'd go, Oh, man, look at her go!""
And I'd go

Do you remember
Coming to the hospital when I was fourteen?
My friends all left me there spinning
Dad was angry, but you saw everything
And you made me laugh as the nurses undressed me
You held my hand as they put the needle in me

I never saw you cry
Not until our dog died
And the whole family came back together
We held her body as they put the needle in her
And then I saw you cry
And then I saw you cry"
​dragon eyes,Adrianne Lenker,songs,"{'year': 2020, 'month': 10, 'day': 1}","Chewing a cigarette and repeating
Shadows of the words I've said
I don't wanna blame you, I don't wanna blame
The stars bloom in the warm summer night
They have a clear view without the bedroom light
They don't wanna name you, they don't wanna name
Dragons have silent eyes
Cracked eggshells, fireflies
I don't wanna tame you, I don't wanna tame
When the hot sand burns my feet
You have cool hands, you are sweet
I don't wanna changе you, I don't wanna change
Carnations into the vase
Unfold your clothеs out of the case
I just want a place with you, I just want a place
As the coastline is shaped by the wind
As we make love and you're on my skin
You are changing me, you are changing
Stars bloom on a warm summer night
They have a clear view without the bedroom light
I just want a place with you, I just want a place $"
​forwards beckon rebound,Adrianne Lenker,songs,"{'year': 2020, 'month': 10, 'day': 23}","Over the Dead Sea
Keeping you company
Thinking, I'm not afraid of you now
I'm not afraid of you now""
Letting my eyes close
Shedding my soft clothes
Wind blows
Wind that howls like a hound
Wind that laughs like a clown

Mystery of lack
Stabbing stars through my back
Forwards, beckon, rebound
Forwards, beckon, rebound

Virtual bedroom
Rise like a full moon
Show me pictures that hang in your house
Pictures that hang in your mouth
Candescent insects
Crosses and fishnecks
I have nothing to pray to you now
Nothing to pray to you now
 
Mystery of lack
Stabbing stars through my back
Forwards, beckon, rebound
Forwards, beckon, rebound


Pulling your face close, wanting the inmost
Show me
I'm not afraid of you now
I'm not afraid of you now
Villain and violent, infant and innocent
Baby, both arms cradle you now
Both arms cradle you now

Mystery of lack
Stabbing stars through my back
Forwards, beckon, rebound
Forwards, beckon, rebound
Forwards, beckon, rebound"
Free Treasure,Adrianne Lenker,Bright Future,"{'year': 2024, 'month': 3, 'day': 18}","Do you wanna go to the river?
I know this spot so deep and green
With wild raspberries and apple trees
And rocks to climb between
Water like a washing machine

Do you wanna dance?
Sometimes I think I try too hard
I trip on my shoes and I trip on my shirt
Get caught on the dirt in the yard
Caught on the dirt in the yard

You show me
Understanding
Patience and pleasure
Time and attention
Love without measure
Love without measure

You're cooking dinner
It's gettin' around halfpastten
I haven't smelled food so good
Since I don't know where and I don't know whеn
Where and I don't know—
 
Stove light glows likе a fire
We're sitting on the kitchen floor
Just when I thought I couldn't feel more
I feel a little more
I feel a little—

Understanding
Patience and pleasure
Time and attention
Love without measure
Love without measure

There's a guy at the nape of my neck
And he hangs out there all day
He quantifies my every thought
And tells me not to play
He tells me not to play

We lay around for hours
Talk about childhood pain
Mom and dad and past lives too
I can tell you anything
I can say anything
You show me
Understanding
Patience and pleasure
Time and attention
Love without measure
Love without measure
Show me
Understanding
Patience and pleasure
The eleventh dimension
Free treasure
Free treasure
Free treasure"
​half return,Adrianne Lenker,songs,"{'year': 2020, 'month': 10, 'day': 23}","Shadow, shadow what a show
Every other step, there's a crosseyed crow
Half return, half return
Minneapolis soft white snow
 bridge, hometown
Half return, half return

Standing in the yard, dressed like a kid
The house is white and the lawn is dead
The lawn is dead, the lawn is dead

Illinois toll road, Indiana plain
Roll the windows down, shoot at the change
Half return, half return
Honey in your mouth when you gave me my name
Tears in your eyes when you pull it likе a chain
Half return, half return

Standing in the yard, drеssed like a kid
The house is white and the lawn is dead
The lawn is dead, the lawn is dead
 

Half return, half return
Rusty swing set, plastic slide
Push me up and down, take me for a ride

Standing in the yard, dressed like a kid
The house is white and the lawn is dead
The lawn is dead, the lawn is dead"
​my angel,Adrianne Lenker,songs,"{'year': 2020, 'month': 10, 'day': 23}","Step over the edge too far
Open my hands that catch your wall
Nothing to hear but my very own cry
Far below the rocks and sky

My angel, my angel
My angel, my angel

Strange as she appears to be
Oldest friend invisibly
She brushes my hair with a physical hand
Lowers my body down to the land

My angel, my angel
My angel, my angel

Beneath the ledge in the morning mist
She kisses my eyelids and my wrists
Wake to the bleeding of the blade of thе sun
Returning to my oxygen
 
My angel, my angеl
My angel, my angel
My angel, my angel"
​come,Adrianne Lenker,songs,"{'year': 2020, 'month': 10, 'day': 23}","Come help me die, my daughter
Walk me beside the river to the beach
Take a branch with your knife
Take my left with your right

Don't be afraid, my girl
Take me into the shore
I'm not cold, I'm not cold
Take my hand, take a hold

Let me lie on your arms
I'm weightless in the sea
Up to my ears the salt sits
In a circle around me

Take my life into your life
Take a branch with your knife

Come help me diе, my daughter $"
Evol,Adrianne Lenker,Bright Future,"{'year': 2024, 'month': 3, 'day': 22}","Love spells evol backwards, people
Words back, words backwards are lethal
Time spells emit, who can see it?
Feel says leaf, tips ease is sea spit

Teach, cheat, part, trap
You have my heart and I want it back
God, dog, devil, lived
The giver takes, the taker gives

Dream is maerd, I'm marred in your mind
Four words: forwards, can't we rewind?
Speech spells hceeps, you say for keeps
To keep me llehs, a shell to speak through

Teach, cheat, part, trap
You have my heart and I want it back
God, dog, devil, lived
The giver takes, the taker gives

Kiss spells sick, the vacuum feeding
Words hold, words hold words from meaning
 
Teach, cheat, part, trap
You have my heart and I want it back
God, dog, devil, lived
The giver takes, the taker gives"
Steamboat,Adrianne Lenker,Hours Were the Birds,"{'year': 2014, 'month': 1, 'day': 9}","Well, I'm just a stranger, I'm only a walker
I guess I am human, but sometimes I feel
Like I'm only a ghost, like I'm only a wall
And if you come around, honey
I'll probably just follow you home
'Cause it's all that I know how to do
I was born by a body, I'll die by one too
And places are nothing if they ain't got you

And one day I'mma be a steamboat baby
One day I can be your freight train lady
I roll down the river and the miles won't phase me
Oh, I wish I was better at being alone
Still every night, I call you on the phone
Oh, I wish I was more than my skin and my bone

Well, I've been arranging each of my movements
And all of my gestures and trying to fool myself
Into thinking that everything's small
That nothing has reason, I woke up and cried
A convulsion of honesty brought me to life
When I thought I was gone
But I can't put a lie in the mouth of a song
 
And one day I'mma be a steamboat baby
One day I can be your freight train lady
I roll down the river, and the miles won't phase me
Oh, I wish I was better at being alone
Still, every night, I call you on the phone
Oh, I wish I was more than my skin and my bone
Oh, I wish I was more than my skin and my bone"
Fool,Adrianne Lenker,Bright Future,"{'year': 2024, 'month': 2, 'day': 20}","I feel like a fool, yeah
Walking downhill with the dogs
You keep it cool
Watching my fire ignite
Heart out of sight
Body and mind fistfight
Heart out of sight
Body like a bat in flight
Oh, they say when it's right, it's right

We could be friends
You could love me through and through
If I were him
Would you be my family too?
Daddy's advice Advicevice)
Hell in paradise
Momma's advice Advicevice)
Cookin' up beans and rice
Oh, just say what it is that you want

Ooh
Ooh
 
Tommy had twins
Kenna and Luy tied the knot
Zoë and B
Built their house on the spot
We could watch a show Show)
We could watch a garden grow
We could grow old Old)
You could come in from the cold
Oh, just say what it is that you want

Huh)
Huhhuh, ahahh)

Jamie's in LA
Ali found a five acre farm
Max is gonna play
Jon got a clown on his arm
Lucky's gonna flip Flip, flip)
Jer's gonna go for a dip Dip, dip)
Birds gotta fly Fly and fly)
I'll love you till I die
Oh, what more can I possibly say?
So if you wanna go, I say, Baby, okay, okay""
Okay, okay, okay, okay, okay, okay, okay, okay
Okay, okay, okay, okay, hmm)"
Ruined,Adrianne Lenker,Bright Future,"{'year': 2023, 'month': 12, 'day': 5}","Until I'm brave enough to call you
I just fall through every time
I wish I'd waved when I saw you
I just watched you passing by

So much coming through, every hour too
Can't get enough of you
You come around, I'm ruined
You come around, I'm ruined

You gave me no answer
Nor asked me to lie
You just gave me an amethyst
From your jeweled vest as you cried

So much coming through, every hour too
Can't get enough of you
You come around, I'm ruined
You come around, I'm ruined
So much coming through, every hour too
Can't get enough of you
You comе around, I'm ruined
You come around, I'm ruined
 
Wе shared in the basement
As the fern bent to the window
And we drew to alignment
As the water soaked the pillow

So much coming through, every hour too
Can't get enough of you
You come around, I'm ruined
You come around, I'm ruined
So much coming through, every hour too
Can't get enough of you
You come around, I'm ruined
You come around, I'm ruined


So much coming through, every hour too
Can't get enough of you
You come around, I'm ruined
You come around, I'm ruined
So much coming through, every hour too
Can't get enough of you
You come around, I'm ruined
You come around, I'm ruined
So much coming through, every hour too
You come around, I'm ruined"
Hours Were the Birds,Adrianne Lenker,Hours Were the Birds,"{'year': 2014, 'month': 1, 'day': 9}","I've got somethin' here, it's a chance
I'm'a make my changes as I go and the city lights dance away stars
I've met all kinds of reasons why the seasons leave their scars
I am thin as cinnamon and tarnished like these metal cars
That drive along the rivers of tar
I am weatherproof as the rain
And I've fooled every lover into drinking up my pain
I am hanging by the edges of my name, but I am warm
So comfortable forgetting 'bout the storm

I love Minnesota, Michigan, Colorado too
Atlanta and Montana, Nebraska and the moon
And you
I must have been a traveller inside of the womb
Never had a place with a living room
You said a house is a tomb
Well zoom, zoom, zoom
Here we go, Annie
No more planning
Isn't this dandy?
I've got you and you've got me
 
I'm going back to the lake
This time of year it's frozen through
Ain't nothing gonna break
I'll take you there and show you where
I used to spend my time
Before working, before leaving, before wine

I love Minnesota, Michigan, Colorado too
Atlanta and Montana, Nebraska and the moon
And you
Life is easy come and it's easy go too
Hours were the birds and I guess they flew
I just can't get a grip on this place, Billy Lou
Well zoom zoom zoom
Here we go, Annie
No more planning
Isn't this dandy?
I've got you and you've got me"
No Machine,Adrianne Lenker,Bright Future,"{'year': 2024, 'month': 3, 'day': 22}","Let no machine eat away our dream
Baby, take my hand, let's go together
No surprise, the wound lives in your eyes
A needle shining like a diamond in the desert

Don't know what I'd do, don't know what I'd do
Without you
Don't know where I'd go, don't know where I'd go
Without you

Talk to me, tell me everything you see
The sun that's shining lighter than a feather
And every day, the moon just sails away
The moon and sun are the keepers of the weather

Don't know what I'd do, don't know what I'd do
Without you
Don't know where I'd go, don't know where I'd go
Without you

Dragonfly, the clouds are rolling by
The wind across my back, I feel the shiver
Drive around, live from town to town
To the ocean of your love, I am a river
 
I don't know what I'd do, don't know what I'd do
Without you
Don't know where I'd go, don't know where I'd go
Without you"
​heavy focus,Adrianne Lenker,songs,"{'year': 2020, 'month': 10, 'day': 23}","Cemetery at night and the dog's in heat
The great grey owl howls and you're probably right
Believe in, better to be leaving
Oh, oh, oh

Terrifying like a gun
Like a gun store
The wind roared
Invisible like a blank
Ghost blanket
No trees bent
Shakey like the first dance
Shakey like the first time
Our palms met in the clam sweat

Heavy focus
Focus, focus, focus

Set the camera to the flash
For a portrait of thе spirit
Only way it's gonna last
To be near it
 
Heavy focus
Focus, focus
Focus, focus
Kiss
Focus, focus"
Donut Seam,Adrianne Lenker,Bright Future,"{'year': 2024, 'month': 3, 'day': 22}","This whole world is dying
Dont it seem like a good time for swimming
Before all the water disappears?

Ever since the day we met
I loved you and I dont regret
The way we passed the time
Drinking coffee, drinking wine
Oh, my heart has holes in it
And there you were exposing it
How I would lose my mind
To get lost only to find

This whole world is dying
Dont it seem like a good time for swimming
Before all the water disappears?

You came in like some good things do
Out of nowhere, dream come true
And showed me things I never knew
What it means to walk that line
And like a moth into the sun
I flew in front of everyone
And burned up in the flame
Now its pouring acid rain, and
 
This whole world is dying
Dont it seem like a good time for swimming
Before all the water disappears?

Now our love is dying
Dont it seem like a good time for kissing?
One more kiss, one more kiss to last the years"
Disappear,Adrianne Lenker,Hours Were the Birds,"{'year': 2014, 'month': 1, 'day': 9}","Lose my thoughts
Lose my dreams
A million different pieces
A million different things
That I can't keep together
That can't seem to see
As they tumble around me
I fall asleep to the sound of the sea
A familiar ocean that's swallowing me
In a whirlwind of wonder
Oh what can it be that I'm missing here?
And I disappear
'Cause this world it keeps trying to pull me down
But my feet, they won't ever find the ground
'Cause my body is made out of sound
And that's all I am
Morning will break
And the winter will take
What it wants of me slowly
But I can't complain
'Cause I'd rather be lonely
And cold and awake
Than asleep in a warm and a comfortable place
 And oh, oh, where do I go from here?
Please direct the melody in my ear
'Cause I have stepped deep into a song that I'd like to forget
And I disappear
Well, this world it keeps trying to pull me down
But my feet, they won't ever find the ground
'Cause my body is made out of sound
And that's all I am
And I can disappear
Just disappear
Just disappear
Find my way out of here
Out of here
Out of here
I can just disappear
Just disappear
Just disappear"
