,Artist,Album,Release Date,Lyrics
Lighthouse,Adrianne Lenker,Hours Were the Birds,"{'year': 2014, 'month': 1, 'day': 9}","Well, I left here in my sleep when I was dreaming
Miles and miles away into a place
My heart was scheming an escape that love drew from me
And I met you on the corner of the seasons
Out of winter's reach and into summer's early sun
You were the moon and I was only seventeen

And now I'm making all these things
And constructing all these scenes
And I'm stitching at the seams
Of the fabric of my dreams
And I'm here in my boat
And I'm rowing up to shore as you sing

Well I'm ringing all the bells from my lighthouse, dear
Time is just an ocean and you're almost here
One for the mind, two for the soul
Three for the body and the heart that knows
That knows I'll never ever let you go

Oh silence, the silence aringing your bells
Singing the words in a whisper
Dispel all this noise, bring back the joy
Ring the world awake
'Cause if the only whole that we have is a world apart
And it's separate and broken and stained from the start
My heart will remain and take it anyway
 
Well, I'm ringing all the bells from my lighthouse, dear
Time is just an ocean and you're almost here
One for the mind, two for the soul
Three for the body and the heart that knows
That knows I'll never ever let you go

I'm ringing all the bells from my lighthouse, dear
Time is just an ocean and you're almost here
One for the mind, two for the soul
Three for the body and the heart that knows
That knows I'll never ever let you go"
​terminal paradise,Adrianne Lenker,abysskiss,"{'year': 2018, 'month': 10, 'day': 5}","Warm
So warm
Screaming in the field
As I was born

Worm
Will you return me
To the robin's beak?
I'll be a bird

Terminal
We both know
Let the rest of me go
See my death become a trail
And the trail leads to a flower
I will blossom in your sail
Every dreamed and waking hour

Woman
Woman
Hold me in your heat
'Til I remember
 
Terminal
We both know
Let me rest, let me go
See my death become a trail
And the trail leads to a flower
I will blossom in your sail
Every dreamed and waking hour"
​from,Adrianne Lenker,abysskiss,"{'year': 2018, 'month': 10, 'day': 2}","No one can be my man
Be my man, be my man
Be my man, be my man
Be my man
No one can be my woman
Be my woman, be my woman

One ear to the ground
One dog at my neck
One tongue to my tongue
Wanting to protect me from
From

No one can be my man
Be my man, be my man
Be my man, be my man
Be my man, be my man
No one can be my woman
Be my woman, be my woman

One ear to the floor
My dog barking loud
I couldn't tell for sure
Where the screaming sound
Was coming from
From
 

One ear to your womb
Puppy on the floor
Baby's coming soon
I wonder if she'll know
Where she's come from
From

From
From
From"
Gone,Adrianne Lenker,Hours Were the Birds,"{'year': 2014, 'month': 1, 'day': 9}","Feels a little like falling asleep on a train
I know that you were right I couldn't let you in
But I held you so tight your breath burned on my skin
And is it near or is it far that we begin?
To know something's near
Not the change in the seasons that scares me, dear
It's the sound in the distance that I start to hear
Some days in my mind, I see you look the same
The way you were two years ago when you came
I see you there softly moving sweet around my pain
Fixing my heart and my hands and my brain
But we knew we couldn't stay, we couldn't stay
And you know something's near
Not the change in the seasons that scares me, dear
It's the sound in the distance I start to hear
When it rolls in just like thunder
When the storm, it breaks
Makes me wonder why you came at all
And you're gone, gone, gone, gone
And when you leave part of you will
Part of me will start to breathe
When you're gone, gone, gone, gone
 Some days I'll admit I don't know what to do
You came in, you gave me the deepest parts of you
But now I'm falling asleep and I'm falling awake
And I don't know now how long it's gonna take
No, no, no
You know something's near
Not the change in the seasons that scares me, dear
It's the sound in the distance I start to hear
When it rolls in just like thunder
And the storm, it breaks
Makes me wonder why you came at all
And you're gone, gone, gone, gone
And when you leave, part of you will
Part of me will start to breathe
When you're gone, gone, gone, gone"
Already Lost,Adrianne Lenker,Bright Future,"{'year': 2024, 'month': 3, 'day': 22}","One, two
One, two, three, four

Already lost beside the line
The mirror is your eye on mine
The mirror is your eye on mine
Trying hard to figure it out of here
The centre is a hole in the sphere
The centre is a hole in the sphere
Say your name, I hope to get it right
You come into my room every night
You come into my room every night

A thousand years or morе
And I've never seen this facе
Never heard this voice before

The honey hills and the frosted sun
Bluer than the ocean
Bluer than the ocean
Why do leaves turn yellow and fall
And who absorbs it all?
Who absorbs it all?
Holding so near, standing so far
How slow and how fast you are
How slow and how fast you are
 
A thousand years or more
And I've never seen this face
Never heard this voice before

Though my love is writing blind
It can always read my mind
It can always read my mind
Shadows shatter at the edges of a smile
We've been down here for a while
We've been down here

A thousand years or more
And I've never seen this face
Never heard this voice before"
Cell Phone Says,Adrianne Lenker,Bright Future,"{'year': 2024, 'month': 3, 'day': 22}","Cell phone says your name
But I don't even hear it ring
The July in winter and September spring
Where way up north is the warmer weather

So together we take the call
And we hold the line through the static sprawl
Though the distances traveled are expanding still
We meet in dreams by the lilac river

Oh, giver of empathy
It is a gift so bitter that you brought to me
'Cause I feel what they're feeling and I know that they're free
And the freedom they take is the earthly burden

Please deliver their angel eyes
On the wings of moths and dragonflies
Through the morning and evening their sun set my sunrise
Let them come to me like the breath I'm taking $"
​blue and red horses,Adrianne Lenker,abysskiss,"{'year': 2018, 'month': 10, 'day': 5}","Blue and red horses on the run
I think the angel is jumping the gun
Little red lantern watching the sun
Maybe the angel is jumping the gun

I'm a lot of boy with a lot of nerve
Do you want to toy with me?
I'm a lot of boy with a lot of nerve
Do you want to toy with me?

Little red flower on your wrist
Maybe the angel fired and missed
Little red flower on your wrist
Maybe the angel fired and missed

I'm a lot of boy with a lot of nerve
Do you want to toy with me?
I'm a lot of boy with a lot of nerve
Do you want to toy with me?

Little red forest in your room
I hope the angel is getting here soon
Little red forest in your room
I hope the angel is getting here soon
 
I'm a lot of boy with a lot of nerve
Do you want to toy with me?
I'm a lot of boy with a lot of nerve
Do you want to toy with me?

Little red flower on your wrist
Maybe the angel fired and missed
Blue and red horses on the run
I think the angel is jumping the gun

I'm a lot of boy with a lot of nerve
Do you want to toy with me?
I'm a lot of boy with a lot of nerve
Do you want to toy with me?

With me?
With me?
With me?"
Candleflame,Adrianne Lenker,Bright Future,"{'year': 2024, 'month': 3, 'day': 22}","Every night I close my eyes
Another day away
You know I love you, I can't explain
Cryin' over the candle flame

I feel God here and there
People tell me it's everywhere
You know I know you can't explain
Cryin' over the candle flame

How 'bout that moon looking back?
Saying, Glad you're here""
When we're together only one thing moves
Everything else stays the same

I see you pray, I want to too
I onetwoonetwofour
Fourtwofivesix bedrooms
So everyone can close a door $"
Butterfly,Adrianne Lenker,Hours Were the Birds,"{'year': 2014, 'month': 1, 'day': 9}","This is your highway, this is your height
Never felt more far away than when I fly
My heart is a violin
And I feel my skin coming off of me again
Up, up, up, how I flew up, up
And forgot about the only things I knew of, oh
Oh my god, as I grew up, up, thought I knew you
Pulling up, getting down
This whole place is crazy town
Music bumping and the lights gone down
Never felt at home in any place I found
Oh, I live in a cold, white wind
And I feel the chill coming over me again
Up, up, up, how I grew up, up
And forgot about the only things I knew of, oh
Oh my god as I grew up, up
How I flew up, up
And the crowd went hush
And the wild wind shook
And my body was crushed by the loose window
Thought I knew you
Thought I knew you $"
Once A Bunch,Adrianne Lenker,Bright Future,"{'year': 2024, 'month': 3, 'day': 22}","Once a buncha times I took it to heart
Everything you told me I took it apart
I pulled you in, pushed you out right from the start
I was leaving before I'd arrived

Eyes magnetic, that moldavite flame
Stopping the traffic, all six lanes
Calling me baby, barely sayin' my name
I was leaving before I'd arrived

Half a margarita, have a little dance
Let's fine dine the demons and give peace a chance

On a Tuesday in August, I was holding your hand
Wednesday in August, I was playing with my band
Thursday in August, I was makin' a plan
Then I shut like a shuttеred Friday

Your lips are elеctric like lightning and rain
Your tastes are eclectic, multigrain
You pull on my shoestrings and you open my brain
But I was leaving before I arrived
 
Half a margarita, have a little dance
Let's fine dine the demons and give peace a chance

We could talk for hours, I could buy you flowers
We could switch off in the movies, and switch off in showers
We can turn it up, turn it down, watch Austin Powers
I was leavin' before I'd arrived

I can take a small thing, blow it up real big
Couldn't fit it in my wallet, couldn't fit it in my rig
I can twist it out and twist it in, I can really dig
About leavin' before I arrive

Half a margarita, have a little dance
Let's fine dine the demons and give peace a chance

You believe in me some, you believe in me a lot
You see all the good stuff I seem to have forgot
You can cheer me up and calm me down, you know the spot
You say Honey, won't you stay a little while?""
And you can make me smile just by looking around
You take me to the invisible lost and found
Where I can find a sweater or an old love letter
About leaving before I arrive""

We can pancake a nickel, we can flapjack a dime
We can waffle a tickle, french toast wine
We can take in bacon, sunshine
Tea off with a coffee and a tan

Half a margarita, have a little dance
Let's fine dine the demons and give peace a chance
Half a margarita, have a little dance
Let's fine dine the demons and give peace a chance
I say lets fine dine the demons and save all the ants"
Vampire Empire,Adrianne Lenker,Bright Future,"{'year': 2024, 'month': 3, 'day': 22}","Watching TV tired, bleeding on the bed
The milk has just expired, all the leaves are dead
I'm not quiet, you've been quiet, just receiving what you said
Reeling, feeding, feeling filled by everything you fed
I see you as you see yourself through all the books you read
Overwhelmed with guilt and realizing the disease

You give me chills, I've had it with the drills
I am nothing, you are nothing, we are nothing with the pills
I am empty 'til she fills, alive until she kills
In hеr vampire empire, I'm thе fish and she's my gills

Falling, yeah
Falling, yeah

I see you there rejecting all your earthly power
Protecting and dissecting 'til you've emptied every hour
We jump into the pond and then we come under the shower
You lay upon my pillow and you open like a flower
I wanted to see you naked, I wanted to hear you scream
Wanted to kiss your skin and your everything
I wanted to be your woman and I wanted to be your man
I wanted to be the one that you could understand
 
You give me chills, I've had it with the drills
I am nothing, you are nothing, we are nothing with the pills
I am empty 'til she fills, alive until she kills
In her vampire empire, I'm the fish and she's my gills

Falling, yeah
Falling, yeah

Well, I walked into your dagger for the last time in a row
It's like trying to start a fire with matches in the snow
And you can't seem to hold me here, can't seem to let me go
So I can't find surrender, can't seem to keep control
You turn me inside out and then you want the outside in
You spin me all around and then you ask me not to spin
You say you wanna be alone and then you want children
You wanna be with me but then you wanna be with him

You give me chills, I've had it with the drills
I am nothing, you are nothing, we are nothing with the pills
I am empty 'til she fills, alive until she kills
In her vampire empire, I'm the fish and she's my gills
Falling, yeah
Falling, yeah"
Snow Song,Adrianne Lenker,Hours Were the Birds,"{'year': 2014, 'month': 1, 'day': 9}","When you walked in, I just stood still
I said I'm sorry, love, I have no will
If I try to move, I'll break and spill
What's left of me, my weight will kill

If I die inside this bitter shell
It will be upon a frozen lake
My knees will break, my breath will swell
The snow around my blood will paint

Lord, I know my timing's off
And all the earth is ragged to the bone, oh, oh
Tired is the burning sea
That calls me to the bottom like a stone, oh oh
And I'm sinking alone

Now inside this blinded bend
I'll pour the ink down through my pen
In sentences that will defend
My misery until the end
 
Lord, I know my timing's off
And all the earth is ragged to the bone, oh, oh
Tired is the burning sea
That calls me to the bottom like a stone, oh oh

And I'm sinking alone
I'm sinking alone
I'm sinking alone"
​cradle,Adrianne Lenker,abysskiss,"{'year': 2018, 'month': 8, 'day': 7}","Cradle more
The hours reel
Cradle more
How you feel

Baby, you're still too proud to come down
Maybe I'm still too loud to hear
All the waves ascend and disappear

Like a storm
The air you steal
Glacial form
The icy heel

Baby, you're still too proud to come down
Maybe I'm still too loud to hear
All the waves ascend and disappear

Earth is born
To wound and heal
Cradle more
The hours reel
 
Baby, you're still too proud to come down
Maybe I'm still too loud to hear
All the waves ascend and disappear"
​womb,Adrianne Lenker,abysskiss,"{'year': 2018, 'month': 10, 'day': 5}","Seven wide years
And there's soil to till
When you thread your fingers through, I feel quite well
We could be the riptide or two mountains growing still

When the eye gets heavy in the womb

Dripping your tears
Like a precious warm spring
My heart will always find you when your heart freely sings
Mine would never bind you with a diamond or a word

When the eye gets heavy in the womb
When the eye gets heavy in the womb

Woman, mighty woman
You're a friend I need
When you hold me to your breast you're bleeding as I bleed
Please reveal the question to me, let the answers leave

When the eye gets heavy in the womb
When the eye gets heavy in the womb
When the eye gets heavy in the womb
When the eye gets heavy in the womb $"
​abyss kiss,Adrianne Lenker,abysskiss,"{'year': 2018, 'month': 10, 'day': 5}","Try and get some rest
I'll do the rest
Think to what the roses find
With the arms of passion
This is how we fashion
Wars remind
In the hour I loved you
Like a dream it was true
In the base of my pine

Wilderness
Vast abyss
Will we ever kiss?

In her mother's fortress
She was brushing horses
Manes and tails, flicking flies
Naked as the window
Baby, if it's real so
No need to apologize

Wilderness
Vast abyss
Will we ever kiss?
 
Love is on her shoulder
Love is on the boulder
In the eyes, in the eyes
Love never leaves
Love is the leaves
In the sky, in the sky"
​what can you say,Adrianne Lenker,abysskiss,"{'year': 2018, 'month': 10, 'day': 5}","What can you say to remind me
How to be loved by you?
Wave to the winding
River, it's a view of you

For the long grass growing in silence
There's an equal knowing inside us
Calmly showing for to guide us

Pray you can find me
I've been busy turning into
More transparent
I could look a lot like you

For the sharp glass cutting of the cold wind
The sharp glass losing of your best friend
The story bruising as it's written

Rain in your bedroom
This is how I love you back
To follow the red moon
Follow her and never look back
 
There's a star that's glowing on your eyelash
And the wet light moaning as we rehash
Oh, my darling
What can you say to remind me
How to be loved by you?"
​out of your mind,Adrianne Lenker,abysskiss,"{'year': 2018, 'month': 10, 'day': 5}","It cannot be explained
Like a single membrane
Same old dream from the pillow
Laugh along with her laugh
Lying when she's lying
She gets angry I feel so

Is it any wonder I get lonesome for you?
Get out of your mind

Demons, demons are the dragons
She is not a dragon
But I'm afraid of her fire
My heart is a wagon
My heart is a wagon
But I can't push her desire

Is it any wonder I get lonesome for you?
Get out of your mind
Annie, my love pulls the trigger on you
Get out of your mind
And into my arms $"
10 miles,Adrianne Lenker,abysskiss,"{'year': 2018, 'month': 10, 'day': 5}","To die in your arms
Your words forming again
We kiss very hard and wild
To rise in the dark
Like birds preying on skin
We prey with our oxygen

Jo, nothing is real
We still have that feel
You're closing up the bar
I'm warming up the car
Ten miles away

Two children of ours
They came twirling in
We laughed very hard for a while
But they've grown very far and tall
How we miss them
Though happy they're traveling

Jo, nothing is real
But we still have that feel
You're closing up the bar
I'm warming up the car
Ten miles away
 
We set no alarm
Eyes wide,  AM
Wake up on the farm
Slowly walk to the barn
Horse feed, you take the yarn
I'll read, I'll read

Jo, nothing is real
But we still have that feel
You're closing up the bar
I'm warming up the car
Ten miles away

To die in your arms
Your words forming again"
Indiana,Adrianne Lenker,Hours Were the Birds,"{'year': 2014, 'month': 1, 'day': 6}","Daddy wanted me to leave it
Indiana, Indiana in the cold
Said, You know you really don't need it
Leave the fame for the road""
I remember when I was leaving
I was only six years old
Oh how my heart was beatin'
About ready to explode

One shot, honey, collect it all
The dust inside the rusted souls
You should get a ride 'cause you can't control
The heart that beats under the bone
Come on, my combat chameleon, give it up
You've got your life to attend to, buttercup
You're entertaining the talk that is told through the teeth of the Mouths of the millions dyin' to meet ya
Little do they know

The Mississippi River won't kill you
Unless you stand too close, my dear
Take you to Louisiana
A long long way from here
And the war's been a long time coming
Yes, a long long war's gonna come
We're standing at the end of a story
At the foot of a palindrome
 
One shot, honey, collect it all
The dust inside the rusted souls
You should get a ride 'cause you can't control
The heart that beats under the bone
Come on, my combat chameleon, give it up
You've got your life to attend to, buttercup
You're entertaining the talk that is told through the teeth of the Mouths of the millions dyin' to meet ya
Little do they know"
​music for indigo,Adrianne Lenker,instrumentals,"{'year': 2020, 'month': 10, 'day': 24}","
I'm starting over
 $"
"​red leaves, falling",Adrianne Lenker,songs,"{'year': 2020, 'month': 10, 'day': 23}","Back in the shadow
Sleeps a morning dove
Frozen meadow
Yellow moon above

Red leaves falling
Through the light, through the light
Red leaves falling
Through the light, through the light

Back in the saddle
On a gravel trail
Broken arrow
For a nightingale

Red leaves falling
Through the light, through the light
Red leaves falling
Through the light, through the light $"
To Violet,Adrianne Lenker,Hours Were the Birds,"{'year': 2014, 'month': 1, 'day': 9}",
A Love of Some Kind,Adrianne Lenker,Hours Were the Birds,"{'year': 2014, 'month': 1, 'day': 9}","But I think Ive seen you
Maybe once or twice before
Either way, I need you
Will you stay?
Nothing much in our way
And the sky is always bending
And I hate pretending like I'm doing fine
Would you mind?
I could use a love of some kind
I've read the books, Ive tried it all
I've lived behind a curtain
And maybe life is protocol
But I still feel uncertain
Every day I get lost in the gray
Where the light is ever vying
And it finds me trying
To find my will and be still
And let go my heart to fill

I know we're strangers, so it's okay, you don't have to say it
Strange is better anyway and I think that we can make it
I don't have much, but what I've got is something I can give
And I've found that on your own is no good way to live
 So what do you say?
Nothing much in our way
And the world is always turning
And the light is yearning
Itll be just fine
Would you mind?
I could use a heart
I could use a home
I could use a love of some kind"
We Were Young,Adrianne Lenker,Hours Were the Birds,"{'year': 2014, 'month': 1, 'day': 9}","Wild and free, seventeen
You were only seventeen
And your mind was beatin' like a djembe drum
We were young, we were young
You were mine and we were young
And our love was burnin'
Life was but a dream

I got lost a few times
You knew everywhere I'd hide
You would look and call, and eventually I'd come
We were young, we were young
We got lost when we were young
But our hearts were always easy to unwind

Two years gone, you were gone
You were off to share your song
Off to heal the aching pieces of the Earth
And it hurt when you left
But I never told you how
'Cause I wanted you to go and travel on
Travel on, travel on
We were young and you were gone
Off to heal the aching pieces of the Earth
 
Oh, love, will you stay awake tonight
We can live tonight
In between this
Oh, phone line, please be clear tonight
Let me hear tonight
Dear, I need this

Ten years flew, and you'd write
And I'd call you every night
And we'd close our eyes and meet there in our sleep
And you'd keep me a light
In your window so I'd know
After all those years that, still, my home is you

Oh, love, will you stay awake tonight
We can live tonight
In between this
Oh, phone line, please be clear tonight
Let me hear tonight
Dear, I need the

Whole world to wait
The whole world to wait
The whole world to wait"
​fangs lungs ankles,Adrianne Lenker,​i won’t let go of your hand,"{'year': 2024, 'month': 3, 'day': 11}","So much easier said than done
I see you see me lie in front of everyone
You come to me, you're like the setting sun
You warm me with your light and then you leave when you're done
On the day you called me your love
I cried into your jacket, wiped snot on my glove

God knows, angel glows
Rainbows, river flows
Wind blows, highs, lows
Eyes closed, windows

Try so hard not to think of you
You hit my mind like a freight train when I do
Neil says razor love cuts straight through
You had me to love and you shot me with it too
God knows, angel glows
Rainbows, river flows
Wind blows, highs, lows
Eyes closed, windows
Guiding those tangles
Making strange angles
Fangs, lungs, ankles
Pain comes, pain goes
 
Try so hard not to be like him
But I threw my fist into the wall again
Trying hard not to see like her
But I freeze so much and I freeze like her
Oops
I see so much that I freeze like her

God knows, angel glows
Rainbows, river flows
Wind blows, highs, lows
Eyes closed, windows
Guiding those tangles
Making strange angles
Pain-- fangs, lungs, ankles
Pain comes, pain goes"
​mostly chimes,Adrianne Lenker,instrumentals,"{'year': 2020, 'month': 10, 'day': 24}",
​feel it all,Adrianne Lenker,​i won’t let go of your hand,"{'year': 2024, 'month': 3, 'day': 11}","To make a pot of coffee and let me cry it out
So much time, so much time
Ive been feeling sad like peace is a radical word
And I just don't want to shoot that beautiful bird
So much time, so much time
No sad is too sad, no hurt too much
No pain too heavy, pretty scars to touch
No light is too bright, no laughter too deep
No secret too small for me to keep
I've been feeling for your five year old self shut up in your room
Feeling unseen and unheard as a handle of a broom
Or your twelve year old believing in a field of wild horses
Sh--
Trying to find your father in a sea of other voices
I have so much time for you, so much time
And no sad is too sad, no hurt too much
No pain too heavy, pretty scars to touch
No light is too bright, no laughter too deep
No secret too small for me to keep
Feel it all
Feel it all
Feel it all
Feel it all
 It doesn't matter if you're real, doesn't matter if you're old
A sapling just beginning or an oak tree wise and bold
What it means for you to be here like the wind and my belief
An ocean of forgiveness and an ocean full of grief
So much time, so much time
And no sad is too sad, no hurt too much
No pain too heavy, pretty scars to touch
And no light is too bright, no laughter too deep
No secret too small for me to keep
Feel it all
Feel it all
Feel it all
Feel it all"
