,Artist,Album,Release Date,Lyrics
Smile / Petty,Anderson .Paak,Oxnard,"{'year': 2018, 'month': 11, 'day': 16}","What is it about my smile that makes you lie to my face?
If I close my eyes to your bullshit, I could still smell it on you
I could smell it from a mile away
You can't be the truth and the lie
Oh no, hey
Make up your mind, baby
What is it about my smile that makes you lie to my face?

Let me ask this, just what does it take to be the apple of your iris?
How much of this bullshit until we reach the pasture?
Ain't no need to gas me, it was lit from the lashes
Back when chitchattin' casually 'bout how you think monogamy is somethin' of the past
But, baby girl, your actions speak somethin' totally opposite
And you have to pardon me, 'cause I am a dog, you see
And if you lead me to the park, I break up off the leash
What is it about my smile that would make you ponder kickin' dirt in my water?
Spillin' bleach in the laundry bag and stressin' my momma
Pushin' dents in my armor, scratchin', dentin' my Pontiac
Bitch, are you off your shit?
I bag another one just to piss you off and shit
Don't make me put the shit I bought you up for auction, bitch

Hold on, hold the fuck up
Pause this shit

My lady drives me high up the wall
She keeps me up and locked in the bathin' room
Why am I screamin' at the top of my lungs?
When she can't hear a word that I say to her?

You petty, petty bitch, Huh, petty)
Calculate All of it)
Trackin' All of it)
All of this Bullshit)
Worthless shit, you packaged up
Tossed out my shit, All of it, all of it, all)
Bitch, now you know that was totally out of pocket

Would've let me fall off
Would you catch me when I fall?)
I won't sweat the small stuff
No more chasin' pennies, no)
I can't keep from fallin' off
Keep me from these useless bitches, these ruthless leeches
I might catch you all alone
I don't need it, I don't need it)

Now bro, he lends me no help at all
He's out there chasin' money that's far too small
Lately, he's talkin' 'bout invest and withdraw
But the loan of which you owe me is far from paid off
Oh, Lord
You petty, petty bitch, Huh, petty)
Calculate All of it)
Trackin' All of it)
All of this Bullshit)
Worthless shit, you packaged up
Tossed out my shit, All of it, all of it, all)
Bitch, now you know that was totally out of pocket"
The Chase,Anderson .Paak,Oxnard,"{'year': 2018, 'month': 11, 'day': 16}","Evacuations are nowAnderson Paak va a estar tocando música en Oxnard
I need you more than you could know
Ooh, ooh, ooh Ahh)
Don't let me down and don't let go Ahh)

Yeah, yeah, I say
You know I hit it almost every time and then I miss one
How we gon' get ourselves up outta this one?
Hard to get up from this like Sonny Liston
Feel like Isaiah and Laimbeer with the Pistons
Bad Boys, but no Will Smith and only real friction
Got to the fork in the road, a split decision
I could eat or split everything, my own decisions
That would take a little more time and more wisdom
That would take a little more grind and more vision
What's the difference between the poor and the rich man?
Standing in line or having wristbands
These are lessons you learn with no tuition

Hold on and ride for your own
Together in spirit form
With your hands I can hold
In your heart there is hope

Time has no weight without heads to implant
Who we are, who we see, so much clearer now
It may not be in their sights but that don't take us out of clear view
Hold on, hold tight, hold tight
Hold on, if not for you then I
Hold on and ride for your own
Together in spirit form"
Twilight,Anderson .Paak,Ventura,"{'year': 2019, 'month': 4, 'day': 12}","Don't be ashamed, don't close the door
Oh, trust me, baby, I've been there before
And I know you think it can't get lower than the floor
Walk out the basement, let's take a tour

It happens to everyone
You're not the only one, girl
This is called growin' up, sugar
Be careful, but still have fun, yeah

You're my twilight when it's awfully dark and I lost my way
'Cause when my life feels off the mark, you put me back in place

I'm just another annoyin' voice Annoyin' voice)
You've heard it so many times, you could make a chorus Make a chorus)
And I know you wonder where that magic is stored Magic stored)
Your mind is a stairway, knock on Heaven's door

It happens to everyone
You're not the only one, girl
This is called growin' up, sugar
Be careful, but still have fun, yeah

You're my twilight when it's awfully dark and I lost my way
'Cause when my life feels off the mark, you put me back in place
You're my twilight when it's awfully dark and I lost my way
'Cause when my life feels off the mark, you put me back in place

It happens to everyone
You're not the only one, girl
This is called growin' up, sugar
Be careful, but still have fun, yeah

You're my twilight when it's awfully dark and I lost my way
'Cause when my life feels off the mark, you put me back in place"
Off the Ground,Anderson .Paak,Venice ,"{'year': 2014, 'month': 10, 'day': 28}","If it's really what you needed, love
Baby, this right here's a one of one
But you can get this hit whenever you want
So here you are now
And it's on now
And it's on right now
Here you are now
And it's on now
And it's on right now
Here we are now
And it's on now
And it's on

Suddenly, suddenly, suddenly
Off the ground
I'm lifting it up
Sending it, sending it, sending it
Off the ground
I'm lifting it up
Cooling it, cooling it, cooling it
Cool it down
I'm lifting you off the ground
I'm getting you off
It's on right now
Suddenly, suddenly, suddenly
Off the ground Off ground)
I'm lifting it up Up)
Sending it, sending it, sending it
Off the ground Off ground)
I'm lifting it up Up)
Cooling it, cooling it, cooling it
Cool it down Cool down)
I'm lifting you off the ground Off ground)
I'm getting you off Up down)
It's on right now

Send it off, send it off, in and out
Give it all, give it all, give it out
There we are, there we are, here and now
Let it all come out, let it all come out

I can move it to wherever you are
We can live this life forever more
Baby, this right here's a one on one
But you can get this **** whenever you want
So here you are now
And it's on now
And it's on right now
Here we are now
And it's on now
And it's on right now

Suddenly, suddenly, suddenly
Off the ground
I'm lifting it up
Sending it, sending it, sending it
Off the ground
I'm lifting it up
Cooling it, cooling it, cooling it
Cool it down
I'm lifting you off the ground
I'm getting you off
It's on right now
Suddenly, suddenly, suddenly
Off the ground Off ground)
I'm lifting it up Up)
Sending it, sending it, sending it
Off the ground Off ground)
I'm lifting it up Up)
Cooling it, cooling it, cooling it
Cool it down Cool down)
I'm lifting you off the ground Off ground)
I'm getting you off Up down)
It's on right now
Suddenly, suddenly, suddenly
Let it be yours, let it carry you
Sweep the fear from your heart
If you need, you can go there
If you see what you want, then go there
Let it be yours, let it carry you
Sweep the fear from your heart
If you need, you can go there
If you see what you want, then go there
Let it be yours, let it carry you Yours, carry)
Sweep the fear from your heart Fear, heart)
If you need, you can go there Need, go there)
If you see what you want, then go there
Let it be yours, let it carry you Yours, carry)
Sweep the fear from your heart Sweep the fear from your heart)
If you need, you can go there If you need, you can go there)
If you see what you want, then go there If you see what you want, then go there)
Let it be yours, let it carry you Let it be yours, let it carry you)
Sweep the fear from your heart Sweep the fear from your heart)
If you need, you can go there If you need, you can go there)
If you see what you want, then go there If you see what you want, then go there)
Let it be yours, let it carry you Let it be yours, let it carry you)
Sweep the fear from your heart Sweep the fear from your heart)
If you need, you can go there If you need, you can go there)
If you see what you want, then go there If you see what you want, then go there)
Let it be yours, let it carry you Let it be yours, let it carry you)
Sweep the fear from your heart Sweep the fear from your heart)
If you need, you can go there If you need, you can go there)
If you see what you want, then go there If you see what you want, then go there)"
Come Down (Remix),Anderson .Paak,Come Down Remixes,"{'year': 2016, 'month': 5, 'day': 26}","
Ya niggas got me high
Niggas got me high

Hey! Well that's exactly what a nigga came for
Huh, you talking shots from afar
I'ma meet you at your front door
Uh, so hard to be doing what you really meant for, beauty
Huh, but don't I make it look easy
Don't I make it look good

You drank up all my liquor, come on
What I'm supposed to do now?
And you talking all that shit, now come on
You gonna have to back it up
If I get too high now, sugar, come on
I might never come down
You know I might never come down
Let me get down
You might not never come down
Now let me come down
You might not never come down
Let me get down!

You might never ever come down
It took too long to get this high off the ground
Don't run, just stay awhile

Can't beat it, can't beat it
Can't beat it, can't beat it with the big bad door
Can't see her with this pitch black Gucci frames on
Let me take these bitches off
Let me get the full scope, hold up
Huh, full screen, HD, let me take another picture
Let me pull it to the preshow
Whoa, cool beans, cool beans
That's a whole lot of reefer
Let me help you with the preroll

You, drank up all my liquor, come on
What I'm supposed to do now?
And you talking all that shit, now come on
You gonna have to back it up
If I get too high now, sugar, come on
I might never come down
You know I might never come down
Let me get down
You might not never come down
Now let me come down
You might not never come down
Let me get down!
You might never ever come down
It took too long to get this high off the ground
Don't run, just stay awhile
You might never ever come down
It took too long to get this high off the ground
Don't run, just stay awhile

Okay now take that, Maybach, where the Wraith at?
The Bentley truck if you can pay that
A small village, you could say that
But you'd rather take your bankroll to Rodeo
Let her raid that? No, tell 'em hell no""
Middle finger, the COINTELPRO
Stick it to the rear like it's velcro
What other country can you sell blow?
And for less than a kilo, man, you get an elbow
I'm gettin' high, never come down
Round up your rile and we'll run it down
Soon as it dries I'ma run the town
I fantasize shooting Trump down
A shot for every black man who got gunned down
By the police with no convictions, still they run 'round
When we protest they tell us pipe down
For Trayvon and Mike Brown
CNN wanna make it blackwhite
Cause we hit the action with a blacklight
Make them suckers act right, yeah!
You, drank up all my liquor, come on
What I'm supposed to do now?
And you talking all that shit, now come on
You gonna have to back it up
If I get too high now, sugar, come on
I might never come down
You know I might never come down
Let me get down
You might not never come down
Now let me come down
You might not never come down
Let me get down!

You might never ever come down
It took too long to get this high off the ground
Don't run, just stay awhile
You might never ever come down
It took too long to get this high off the ground
Don't run, just stay awhile"
Good Heels,Anderson .Paak,Ventura,"{'year': 2019, 'month': 4, 'day': 12}","I don't mind waitin’ if it don't take too long
I don't mind stayin’, baby, we drove your car
I don't mind pacin' outside, but, damn, it's cold
It's too cold, it's too cold

Oh, damn, oh, friend
Too much fun in the AM
I forgot my keys and my clothes
Is your girl comin' home?
'Cause its cold now and Im locked out Locked out)
Oh, hell, too real
Waitin' outside in my good heels
I forgot my keys and my clothes
Is your girl comin’ home?
'Cause it's cold now and I'm locked out

Say what Im gon' do? What I'm 'posed to say?
You gon' get me killed, I'ma catch a fade
She'll be home soon, yeah, she'll be on the way
I just hit the , shit, I'm in the Palisades
You gon' have to pull up, uh, the fire escape, uh
Open up the window, get your little thangs
Get your little keys, get your little rings
Just free in the wind, though, before she see your face"
Already,Anderson .Paak,Venice ,"{'year': 2014, 'month': 10, 'day': 28}","Surfs the way he acts
You'll never know what he's going to do next
But one thing is for sure
It will either be radical or funny, or both
Say, Im on, Im on, am in the morn'
Still, Im ready, even if I dont go
Baby girl, Im still holdin' on since I popped out the hole
Still, Im ready if I dont go

Said
Im naked down to my socks, bitch, Im Anthony Kiedis
All this Charmin I got, put that right to your sneezer
Ride around on my block, VTA K Teasey K Teasey)
Fuck the police, okay, back to my thesis
Hoes: dont love em, dont treat em, I just teach em to stroke em
Pass that over to LODEF, he gon’ pass it to Jose
He gon’ lend it to Mikos, okay, bases are loaded
If she make it to Parker, she MVP with the trophy
Like Eric Wright with the shotty, Curtis May with the fender
Flava Flav wit' the clock, I had no time to play pitcher
You niggas acting like goalies, you's a hatin’ defender
I stay on Ps and Qs since the top of my sentence

And Im ready if I dont go
Dont go, I dont go
Im ready, but dont go
Dont go, dont
Motherfucker, Im ready

They oughta know, they oughta see
How you feeling, uhhh, that's that Master P! It's that Master P)
Did you roll or make it mine Make your mind up)
We stay whole and you can wind You can wind up)
Pick on the floorda, they gonna pop that cola
Bitch niggas wanna roll up, bitch nigga, here, get rolled up
Slow motion, watch me bend that corner Bend that corner)
Slow motion, then she give me more, muh
I cant stand what you got
Girl, your ass is Movado, I cant help but to watch
Collard greens in my pot
All these clouds, I think I finally see the top, and motherfucker

Im ready if I dont go
I dont go, I dont go
Im ready if I dont go
If I dont go, if I dont go
Motherfucker, Im ready
I dont go
Im ready
If I dont go, if I dont
Motherfucker, Im ready

If you got a problem, we can light it up
Light it up, we can light it up
If you got a problem, we can light it up
Light it up, we can light it up
If you got a problem, we can light it up
Light it up, we can light it up
If you got a problem, we can light it up
Light it up, we can light it up"
XXL Freshman Freestyle: Anderson .Paak,Anderson .Paak,Freshman Freestyles (Class of 2016),"{'year': 2016, 'month': 6, 'day': 22}","The tension is high but niggas is still fly
Sophisticated puppets with political ties
Organized crime, paperback shrine
Pussy with a price tag, money all the time
Pills and a nightcap runnin' through your spine
Niggas sippin' lean, what a fiend for the high
Addiction is a bitch but we thuggin' 'til the end
And these bitches love the glitz so I'm turnin' up the lights
I'm rollin' out the whips, throwing the dice
You can roll if you like, do what you feel
You wanted a show? Just open your eyes
This is life as you know it
A few make it through, most won't survive
A penny with a hole with no hope inside
It's survival of the fittest
And my niggas went to dentists
So we taking a bite
And I made up my mind
The whole world loves you when you're top of the line
The hoes gon' want you when you're thuggin' it right
But the feds gon' bust you if your money too husky, man
Trust me, devils want you livin' in fright
Ain't that right?"
The City,Anderson .Paak,Venice ,"{'year': 2014, 'month': 10, 'day': 28}","Venice, California
Known then as Venice: Slum by the Sea""

There's no need to wear these shades when I drive
I need to see the leap before the stride
There's so much more that can happen, I'm sure that you can imagine
I live around here, let me show you how to walk it, stop the traffic Say, say)
Them two legs will get you right for action with good brain that get you all the answers
That get you all the cash and fashion, just bat your lashes and

Tell me where you wanna go
But I don't really think that it could get much better
The city I love, city I love, city I love
You tellin' me you wanna break free, I bet you never, bet you never

Powder your nose, love
Smoke if you want to Yeah)
Put your feet in the water
The city belongs to you, girl, it's all for you Tell me where you wanna go, it's all for you)

Go, go, gooh, ah) Tell me where you wanna go Tell me where you wanna go)
Go, go, gooh, ah) Tell me where you wanna go Tell me where you wanna go, it's all for you)
Go, go, ohoh, go) Tell me where you wanna go Tell me where you wanna go)
Go, go, gooh, go) Tell me where you wanna go Tell me where you wanna go, it's all for you)
Go, ah, gogo, go) Tell me where you wanna go Tell me where you wanna go)
Oh, ah, gogo, ah) Tell me where you wanna go Tell me where you wanna go, it's all for you)
Go, go, gogo, ah) Tell me where you wanna go, oh Tell me where you wanna go, it's all for you)
Ah, go, gogo, go, ah) Just do tell me where you wanna go It's all for you)

So when you're living the dream, is it hard to see? Does your heart beat heavenly?
I think it's much more than the green leaf but it helps of course
There's only one season, can you believe the way that they talk about my paradise?
We don't need that kind of vibe, no, no

Don't tell me where you're from, girl
Tell me where you wanna get to
The city I love, city I love, city I love
You wanna break free on me, I bet you never, bet you never

Powder your nose, love
Smoke if you want to Yeah)
Put your feet in the water
The city belongs to you, girl, it's all for you

Don't tell me where you're from, girl
Tell me where you wanna get to
Put your feet in the water
The city belongs to you, girl, it's all for you Go, go, gooh, go, tell me where you wanna go, it's all for you)

Go, go, gooh, go) Tell me where you wanna go Tell me where you wanna go)
Go, go, gooh, go) Tell me where you wanna go Tell me where you wanna go, it's all for you)
Go, go, ohoh, go) Tell me where you wanna go Tell me where you wanna go)
Go, go, gogo, go) Tell me where you wanna go Tell me where you wanna go, it's all for you)
Go, go, gogo, go) Tell me where you wanna go Tell me where you wanna go)
Go, go, gogo, go) Tell me where you wanna go Tell me where you wanna go)
Go, go, gogo, go) Tell me where you wanna go Tell me where you wanna gooh)
Go) Tell me where you wanna go"
Left to Right,Anderson .Paak,Oxnard,"{'year': 2018, 'month': 11, 'day': 16}","Yeah, them label me a criminal
Like me some type of animal
They wan' call me cannibal True)
Celebratin' like it's carnival Yeah)
Left turn, signal
Bury the food in funeral
Ya haffi respect principle
You niggas do it to a minimal Minimal)
I bruck you down to a mineral
My gyal, we finally made it to the pinnacle
How long you niggas waited for the antidote?
My god, she got a stance like an antelope
Oh, yes lawd)
An ass like a cantaloupe
Now strike a pose for the camera, yo
And go

Left to right, leftleft to right
Left to right, leftleft to right, go
Run it up, gyal, bring it low
Salute me like a fivestar general
Jump left to right, leftleft to right
Left to right, leftleft to right, oh
Bend over, gyal, touch your toe
Show me yoga, bend ya bone
And go left to right, leftleft to right

Girl, I'm back to act a fool wit' it
Said it all, I gotta fool wit' it
A nigga know just what to do with it
Real life, I know you miss me like you miss Obama
Real time, I been gettin' busy with them commas
Feels like I've been livin' life without a conscience
Realize that you're fuckin' with a real monster
The big screen, watchin' revolt
You're too lie, ya say ya do what ya don't
See me now, you need fi hang up me coat
Big cloud, you see the ting weh me smoke
'Nuff gyal wan' come rip off them clothes bumbaclart)
Shot fly, clip off them nose
Cruiseliner, you know we control the boat
Who's finer? Fuck it, I'll take them both
They wanna break bread? Fuck it, I'll give 'em a loaf
I always encourage a nigga growth
Bad gyal, hold me down, never go
Buckwild, bustin' off a chemical
Sit it down, somethin' nice for ya hole
Ya poompoom pivotal, awoh
Now come, come, get it all
Let we make a movie, digital

Left to right, leftleft to right
Left to right, leftleft to right, go
I tried to tiptoe around it
Ya take me for fool
I lost my mind, but I found it
Now look at how I groove, ah
Pressed up beside me, hittin' me witcha thigh
Remindin' me what I do this for
So critical, so physical
So difficult, but still a miracle
I'm fuckin' up the weekend, I'm jumpin' off the deep end
I'm high as fuck in this bitch, think I'm finally peakin'
They wanna see me in a cell, they want me in the precinct
They wanna see me broke and sad, they want me streetsweepin'
They keep screamin' about, Give us somethin' decent""
Now, why you disturbin' me now? Bitch, I'm in a meetin'

Left to right, leftleft to right
Left to right, leftleft to right, go

Left turn, siginal
Bury the food in funeral
Ya haffi respect principle
You niggas do it to a minimal Minimal)
I bruck you down to a mineral
My gyal, we finally made it to the pinnacle
How long you niggas waited for the antidote?
My god, she got a stance like an antelope
Oh, yes lawd)
An ass like a cantaloupe
Now strike a pose for the camera, yo
And go
Left to right, leftleft to right
Left to right, leftleft to right, oh
I tried to tiptoe around it
Ya take me for fool
I lost my mind, but I found it
Now look at how I groove, ah
Pressed up beside me, hittin' me witcha thigh
Remindin' me what I do this for
So critical, so physical
So difficult, but still a miracle
Left to right, leftleft to right
Left to right, leftleft to right, go
Left to right, leftleft to right
Left to right, leftleft to right, go
Left to right, leftleft to right
Left to right, leftleft to right, go

So critical So critical)
So physical So physical)
So difficult So difficult)
But still a miracle Bumbaclart)"
Get ’Em Up,Anderson .Paak,Venice ,"{'year': 2014, 'month': 10, 'day': 28}","All up in the air
All up in the air
All up in the air
All up in the air

Kim plays with the heart strings
Late nights in the basement
Kills me with them soft notes
Offbeat placements
So sweet with the long notes
Blue dream and the light glow
I'll wait for the next show
But if you leave then I might roll
On your marks
When you're ready
Let me start
Okay, two shots and a slow dance
We walk to your home stand
Keep up, keep up, keep up if you can

Something different, ain't it?
Nothing like we planned
This ain't complicated

All up in the air, all up in the air
We walk in the same direction with no common plans
Guess it's just the nature of a man, prob'ly cover good, good, good
All up in the air
All up in the air
And if it's love, then it's love
But if it's not love, then it's all love
All up in the air, all up in the air
And if it's love, then it's real
But if it's not love, then it's no deal
All up in the air, all up in the air
Get 'em up)
All up in the air
All up in the air
All up in the air
All up in the air Yeah)

Slow dance in your compound when you're off that brown
Freelance in your hometown and it's good work now
Now, set it all down
Set it all down)
Set it all, set it all, set it all back down Yeah)
On your marks
When you're ready
Let me start Okay)
Smooth talkin' and they stare
How often are you here?
Keep on, keep on, keep on if you care
Something different, ain't it?
Nothing like we planned
This ain't complicated

All up in the air, all up in the air
We walk in the same direction with no common plans
Guess it's just the nature of a man
Prob'ly cover good, good, good
All up in the air, all up in the air
And if it's love, then it's love
But if it's not love, then it's all love
All up in the air, all up in the air
And if it's love, then it's real
But if it's not love, then it's no deal
All up in the air, all up in the air
Get 'em up)
All up in the air, all up in the air
All up in the air, all up in the air"
Put You On,Anderson .Paak,Venice ,"{'year': 2014, 'month': 10, 'day': 28}","You cold, you cold, you the coldest
I just wanna know who put you on it
Homage to your teacher
Knowledge is the motherfuckin' key
New move, got a lot of 'em
Remember when you only knew to ride on it?
Now you be tossin' it like Serena
And I'ma run it back like a rerun Eyy)

Who put you on, who put you on to that?
You didn't know about nothin'
Now you know all about nuttin'
I put you on to that Ha, ha, ha)
Now look at you, who put you on to that? Haa)
You didn't know about nothin'
Now you know all about nuttin'
I put you on to that

You know, you know you my favourite
I be steady drinkin' with you, babe, and
Long strokes to the promise
Remember you couldn't take it at all?
New moves, got a lot of 'em
Tell me, when the hell you get so long winded?
Talkin' and walkin' just like a diva
And you gon' hit them notes like Aretha Eyy)

Who put you on, who put you on to that?
You didn't know about nothin'
Now you know all about nuttin'
I put you on to that Ha, ha, ha)
Now look at you, who put you on to that? Haa)
You didn't know about nothin'
Now you know all about nuttin'
I put you on to that
Who put you on, who put you on to that?
You didn't know about nothin'
Now you know all about nuttin'
I put you on to that Ha, ha, ha)
Now look at you, who put you on to that? Haa)
You didn't know about nothin'
Now you know all about nuttin'
I put you on to that

Ha, ha, ha
Haa"
