,Artist,Album,Release Date,Lyrics
Cigarette Daydreams,Cage The Elephant,Melophobia,"{'year': 2013, 'month': 10, 'day': 8}","Did you stand there all alone?
Oh, I cannot explain what's going down
I can see you standing next to me
In and out somewhere else right now
You sigh, look away
I can see it clear as day
Close your eyes, so afraid
Hide behind that baby face

Dododo, dododo

You can drive all night
Looking for the answers in the pouring rain
You wanna find peace of mind
Looking for the answer

Funny how it seems like yesterday
As I recall, you were looking out of place
Gathered up your things and slipped away
No time at all, I followed you into the hall
Cigarette daydreams
You were only seventeen
So sweet with a mean streak
Nearly brought me to my knees

Dododo, dododo

You can drive all night
Looking for the answers in the pouring rain
You wanna find peace of mind
Looking for the answer
If we can find a reason, a reason to change
Looking for the answer
If you can find a reason, a reason to stay
Standing in the pouring rain

Dodo, dododo
Dodo, dodododo
Dodo, dododo
Dodo, dodododo

You can drive all night
Looking for the answers in the pouring rain
You wanna find peace of mind
Looking for the answer
If we can find a reason, a reason to change
Looking for the answer
If you can find a reason, a reason to stay
Standing in the pouring rain"
Trouble,Cage The Elephant,Tell Me I’m Pretty,"{'year': 2015, 'month': 11, 'day': 19}","Ooh, oohooh
Oohooh
Ooh, oohooh
Oohooh
Ooh, oohooh
Oohooh
Ooh, oohooh
Oohooh

We were at the table by the window with the view
Casting shadows, the sun was pushing through
Spoke a lot of words, I don't know if I spoke the truth

Got so much to lose
Got so much to prove
God, don't let me lose my mind

Trouble on my left, trouble on my right
I've been facing trouble almost all my life
My sweet love, won't you pull me through?
Everywhere I look, I catch a glimpse of you
I said it was love and I did it for life, didn't do it for you

Ooh, oohooh
Oohooh
Ooh, oohooh
Oohooh

We will come to pass, will I pass the test?
You know what they say, yeah
The wicked get no rest
You can have my heart, any place, any time

Got so much to lose
Got so much to prove
God, don't let me lose my mind

Trouble on my left, trouble on my right
I've been facing trouble almost all my life
My sweet love, won't you pull me through?
Everywhere I look, I catch a glimpse of you
I said it was love and I did it for life, didn't do it for you

Trouble on my left, trouble on my right
I've been facing trouble almost all my life
My sweet love, won't you pull me through?
Everywhere I look, I catch a glimpse of you
I said it was love and I did it for life, didn't do it for you

Ooh, oohooh
Oohooh
Ooh, oohooh
Oohooh
Ooh, oohooh
Oohooh
Ooh, oohooh
Oohooh

Got so much to lose
Got so much to prove
God, don't let me lose my mind"
Ain’t No Rest for the Wicked,Cage The Elephant,Cage The Elephant,"{'year': 2008, 'month': 6, 'day': 16}","I was walking down the street when out the corner of my eye
I saw a pretty little thing approaching me
She said, I never seen a man, who looks so all alone
Oh, could you use a little company?
If you pay the right price, your evening will be nice
And you can go and send me on my way.""
I said, You're such a sweet young thing, why you do this to yourself?""
She looked at me and this is what she said:

Oh there ain't no rest for the wicked
Money don't grow on trees
I got bills to pay, I got mouths to feed
There ain't nothing in this world for free
Oh no, I can't slow down, I can't hold back
Though you know, I wish I could
Oh no there ain't no rest for the wicked
Until we close our eyes for good""

Not even fifteen minutes later I'm still walking down the street
When I saw the shadow of a man creep out out of sight
And then he swept up from behind, he put a gun up to my head
He made it clear he wasn't looking for a fight
He said, Give me all you've got, I want your money, not your life
But if you try to make a move, I won't think twice""
I told him, You can have my cash, but first you know I gotta ask
What made you want to live this kind of life?""

He said, There ain't no rest for the wicked
Money don't grow on trees
I got bills to pay, I got mouths to feed
There ain't nothing in this world for free
Oh no, I can't slow down, I can't hold back
Though you know, I wish I could
Oh no there ain't no rest for the wicked
Until we close our eyes for good""

Well now a couple hours passed and I was sitting in my house
The day was winding down and coming to an end
And so I turned on the TV and flipped it over to the news
And what I saw I almost couldn't comprehend
I saw a preacher man in cuffs, he'd taken money from the church
He'd stuffed his bank account with righteous dollar bills
But even still I can't say much because I know we're all the same
Oh yes, we all seek out to satisfy those thrills
You know there ain't no rest for the wicked
Money don't grow on trees
We got bills to pay, we got mouths to feed
There ain't nothing in this world for free
Oh no we can't slow down, we can't hold back
Though you know we wish we could
Oh no there ain't no rest for the wicked
Until we close our eyes for good"
Come a Little Closer,Cage The Elephant,Melophobia,"{'year': 2013, 'month': 8, 'day': 13}","Time shakes, found you at the water
At first you were my father
Now I love you like a brother
Earthquakes shake the dust behind you
This world at times will blind you
Still I know I'll see you there

Come a little closer, then you'll see
Come on, come on, come on
Things aren't always what they seem to be
Come on, come on, come on
Do you understand the things that you've been seein'?
Come on, come on, come on
Do you understand the things that you've been dreamin'?
Come a little closer, then you'll see

Heartbreaks, the heavy worlds upon your shoulders
Will we burn on or just smolder?
Somehow I know I'll find you there
Ooh, you wanna see if you can change it, change it
Still I know I'll see you there

Come a little closer, then you'll see
Come on, come on, come on
Things aren't always what they seem to be
Do you understand the things that you've been seein'?
Come on, come on, come on
Do you understand the things that you've been dreamin'?
Come a little closer, then you'll see
Come a little closer, then you'll see

Ten thousand people stand alone now
And in the evening the sun sank
Tomorrow it will rise
Time flies by,"" they all sang along
Time flies by,"" they all sang along
Time flies by,"" they all sang along
Time flies by, by""

Come a little closer, then you'll see
Come on, come on, come on
Come a little closer, then you'll see
Come a little closer, then you'll see
Come a little closer, then you'll see"
Telescope,Cage The Elephant,Melophobia,"{'year': 2013, 'month': 10, 'day': 8}","In a far and distant galaxy
Inside my telescope I see
A pair of eyes peer back at me
He walks and talks and looks like me
He sits around inside his house
From room to room, he moves about
Fills his life with pointless things
And wonders how it all turns out

Dododododo
Dododododo
It's safe to say that

I don't think you understand
There's nowhere left to turn, the walls keep breaking
Time is like a leaf in the wind
Either it's time well spent or time I've wasted
Don't waste it

Afraid of what the truth might bring
He locks his doors and never leaves
Desperately searching for signs
Too terrified to find a thing
He battens all the hatches down
And wonders why he hears no sounds
Frantically searching his dreams
He wonders what it's all about

Dododododo
Dododododo
It's safe to say that

I don't think you understand
There's nowhere left to turn, the walls keep breaking
Time is like a leaf in the wind
Either it's time well spent or time I've wasted

Here in my mind, losing my friends
Fall on my face, do it again
You say, How do you do?""
Man, how 'bout you? Man, how 'bout you?
To be free, to be sold
To be killed, to be safe
In my head, I'm alone
I'm not dead, I'm ashamed
Just like you, I've been trying to escape
In my bones, I feel cold
I give thanks to the Lord
Industry, in the street
Let me go, let me be
I don't need to be here
I'm alone, can't you see? Can't you see?
I don't think you understand
There's nowhere left to turn, these walls keep breaking
Time is like a leaf in the wind
Either it's time well spent or time I've wasted
Don't waste it"
Cold Cold Cold,Cage The Elephant,Tell Me I’m Pretty,"{'year': 2015, 'month': 12, 'day': 18}","Doctor, look into my eyes
I've been breathing air, but there's no sign of life
Doctor, the problem's in my chest
My heart feels cold as ice, but it's anybody's guess

Doctor, can you help me? 'Cause I don't feel right
Better make it fast before I change my mind
Doctor, can you help me? 'Cause I don't feel right
Better make it fast before I change my mind

Well, it's cold, cold, cold, cold inside
Darker in the day than the dead of night
Cold, cold, cold, cold inside
Doctor, can you help me? 'Cause something don't feel right
Something don't feel right

Sweet nurse, don't look at me that way
I've seen those eyes before, I can tell you want to play
Counselor, give me some advice
Tell me, how hard will I fall if I live a double life?

Doctor, can you help me? 'Cause I don't feel right
Better make it fast before I change my mind
Doctor, can you help me? 'Cause I don't feel right
Better make it fast, because there ain't much time

Well, it's cold, cold, cold, cold inside
Darker in the day than the dead of night
Cold, cold, cold, cold inside
Doctor, can you help me? 'Cause something don't feel right
Something don't feel right
Something just ain't right

And as the darkness falls, it fills up both my eyes
My life before me like a flash in the night
With my arms open wide

Well, it's cold, cold, cold, cold inside
Cold, cold, cold, cold inside
Cold, cold, cold, cold inside
Doctor, can you help me? 'Cause something don't feel right
Something don't feel right
Something just ain't right"
Social Cues,Cage The Elephant,Social Cues,"{'year': 2019, 'month': 4, 'day': 19}","I think it's strange when people say
You're the next big thing, you'll never fade
The slightest touch, forced to fold
Sleight of the hand, modern gold

Starryeyed child left behind
Choose your favorite vice
I don't have the strength to play nice

Hide me in the back room, tell me when it's over
Don't know if I can play this part much longer
I'll be in the back room, tell me when it's over
Don't know if I can play this part much longer
I don't know if it is right to live this way, yeah
I'll be in the back room, tell me when it's over
People always say, Man, at least you're on the radio""

At least you're on the radio, oh
At least you're on the radio, huh
At least you're on the radio, oh

Close your eyes, don't be afraid
Take some of these, they'll ease the pain
Live fast, die young, pay the price
The best die young, immortalized

Starryeyed children left behind
To choose their favorite vice
I don't have the strength to think twice

Hide me in the back room, tell me when it's over
Don't know if I can play this part much longer
I'll be in the back room, tell me when it's over
Don't know if I can play this part much longer
I don't know if it is right to live this way, yeah
I'll be in the back room, tell me when it's over
People always say, Man, at least you're on the radio""

At least you're on the radio, oh
At least you're on the radio, huh

Hide me in the back room, tell me when it's over
Don't know if I can play this part much longer
I'll be in the back room, tell me when it's over
Don't know if I can play this part much longer
I don't know if it is right to live this way, yeah
I'll be in the back room, tell me when it's over
People always say, Man, at least you're on the radio""
At least you're on the radio, oh"
Ready to Let Go,Cage The Elephant,Social Cues,"{'year': 2019, 'month': 1, 'day': 31}","Sun went down, sun went down over Pompeii
On both sides, a vow was broken
Oh my, my, I'm the one
Trying to hide this damage done
One day, all our secrets will be spoken

As we slow danced, I became your statue, frozen
Times I wonder are we just a puff of smoke? Yeah
Underneath this bed of ashes, still withholding everything
Like we were never close

Dont you worry, baby, no sense trying to change it
I'ma strike these matches, never had control
I'm ready to let go, no, was I fooling myself?
Ima spread these ashes, never had control
I'm ready, I'm ready, I'm ready to let go

Sun went down, sun went down over Pompeii
On holy ground, our vows were broken
We met up, we broke bread
I was blue, your dress was red
Ain't it strange?
We both knew this day was coming

As we slow danced, I became your statue, frozen
Times I wonder are we just a puff of smoke? Yeah
Underneath this bed of ashes, still withholding everything
Like we were never close

Don't you worry, baby, no sense trying to change it
I'ma strike these matches, never had control
I'm ready to let go, no, was I fooling myself?
Ima spread these ashes, never had control
Im ready, I'm ready, Im ready to let go

Don't you worry, baby, no sense trying to change it
I'ma strike these matches, never had control
I'm ready to let go, no, was I fooling myself?
Ima spread these ashes, never had control
I'm ready, I'm ready, I'm ready to let go"
Sweetie Little Jean,Cage The Elephant,Tell Me I’m Pretty,"{'year': 2015, 'month': 12, 'day': 18}","Sweetie Little Jean, where did you go?
Everyone's been searching high and low
And your mother's worried sick
Dearest daddy lost his grip
While the whole world's watching
Candlelight vigils being held in silence
On the channel four
And they've knocked on every door
Every place you've been before

How long will we let it go?
I think we should just let go

I, I want you back back)
Let's get back
Lay my weary head against your bones
Where all my troubles will be dead and gone

How long will we let it go?
I think we should just let go

Has melancholy taken you for good?
You know that I would save you if I could
Watched your laughter turn to tears
Then you vanished in thin air
Well we pinned your missing persons picture up
On every motherloving post
How's it feel to be a ghost?
You're the one I love the most

I, I want you back back)
Let's get back
Lay my weary head against your breast
Where all our troubles will be laid to rest

I pushed and I pulled 'til I pushed you aside
Now all that is left are the tears that you cried
I'm sorry love for all of the damage done
My only hope is someday to be back beside you

I, I want you back back)
Let's get back
Lay my weary head against your bones
Where all our troubles will be dead and gone

How long will we let it go?
I think we should just let go"
Shake Me Down,Cage The Elephant,"Thank You, Happy Birthday","{'year': 2010, 'month': 11, 'day': 22}","Shake me down, not a lot of people left around
Who knows now? Softly laying on the ground
Oooh not a lot of people left around oooh oooh

In my life I have seen people walk into the sea
Just to find memories plagued by constant misery
Their eyes cast down, fixed upon the ground
Their eyes cast down

I'll keep my eyes fixed on the sun

Shake me down, cut my head on a silver cloud
Broken sound, softly laying on the ground
Oooh not a lot of people left around oooh oooh

In my past, bittersweet, there's no love between the sheets
Taste the blood, broken dreams, lonely times in deed
With eyes cast down, fixed upon the ground, with eyes cast down

I'll keep my eyes fixed on the sun
Turn back now, it's time for me to let go
Way down, had to find a place to lay low
Lamp shade, turned around into a light post

Walk around the corner, never saw it coming, still
I try to make a move it almost stopped me from belief
I don't want to know the future, I'm like Rolling Thunder
Even on a cloudy day
Even on a cloudy day
Even on a cloudy day
Even on a cloudy day
Even on a cloudy day
Even on a cloudy day
Even on a cloudy day

I'll keep my eyes fixed on the-
I'll keep my eyes fixed on the-
I'll keep my eyes fixed on the sun

Shake me down, not a lot of people left around
Oooh oooh"
Too Late To Say Goodbye,Cage The Elephant,Tell Me I’m Pretty,"{'year': 2015, 'month': 12, 'day': 4}","Oh my precious ember burning, my sweet glowing light
From the moment I first saw you, I was yours and you were mine
Deep down we both knew you were trouble by design
And the echo of my mother's words, Baby, don't you play with fire""

I was always playing the part
First love only set by a spark
There was no way changing my mind

Now I'm under your spell, trapped in a lie
Shouldn't have stood that close to the fire
No turning back, nowhere to run, nowhere to hide
It's too late to say goodbye
Push back from my heart
Wish we could go back to the start
But oh my god, is this real?
No more time
It's too late, it's too late to say goodbye

I can hear the sounds of sirens circling around
Forced to watch the ashes floating, softly drifting to the ground
Deep down we both knew it was trouble by design
And the echo of my mother's words, Baby, don't you play with fire""

I was always playing the part
First love only set by a spark
There was no way changing my mind

Now I'm under your spell, trapped in a lie
Shouldn't have stood that close to the fire
No turning back, nowhere to run, nowhere to hide
It's too late to say goodbye
Push back from my heart
Wish we could go back to the start
But oh my god, is this real?
No more time
It's too late, it's too late, it's too late to say goodbye

After all the dust has settled, we can settle down
Just the two of us forever, no one else around
No one else around
Around

Now I'm under your spell, trapped in a lie
Shouldn't have stood that close to the fire
No turning back, nowhere to run, nowhere to hide
It's too late to say goodbye
Push back from my heart
Wish we could go back to the start
But oh my god
No escape
No more time
It's too late, it's too late, it's too late to say goodbye"
Black Madonna,Cage The Elephant,Social Cues,"{'year': 2019, 'month': 4, 'day': 19}","Soft glow on the city
She said, There's no one here who can touch you now""
Caught the last flight out of LAX
With your oneway ticket, New Yorkbound

Climb so high, don't make a sound
Don't you forget what goes up must come down
Climb so high, tell me how it feels

Call me when you're ready to be real
Black Madonna, hallelujah
Makes no difference here, so let's be real
Black Madonna, my black flower
Nowhere left to run, nowhere left to hide
You're not havin' fun, I think that you should ride
Call me when you're ready to be real
Black Madonna, my hallelujah

On the phone you sound shifty
You say that you're at home, alone right now
But in the background there's a muffled laugh
As you spin that wool and pull it down

Climb so high, don't hear a sound
Don't you forget what goes around, comes around
Climb so high, tell me how to feel

Call me when you're ready to be real
Black Madonna, hallelujah
Makes no difference here, so let's be real
Black Madonna, my black flower
Nowhere left to run, nowhere left to hide
Says it should be gone, at least it was this time
Call me when you're ready to be real
Black Madonna, my hallelujah

Call me when you're ready to be real
Black Madonna, hallelujah
Makes no difference here, so let's be real
Black Madonna, my black flower
Nowhere left to run, nowhere left to hide
You're not havin' fun, I think that you should ride
Call me when you're ready to be real
Black Madonna, my hallelujah"
Spiderhead,Cage The Elephant,Melophobia,"{'year': 2013, 'month': 10, 'day': 8}","I am the one you left for dead
Say you want it, too
You are the bullet in my head
And as you stand over my grave
Tell me it's okay
Your porcelain lips upon my face

Either I'm in heaven, or I'm in hell
Am I losing my mind here? 'Cause I can't tell
I've been waiting for answers for way too long
Seems I'm always waiting around

Spiders in my head, spiders in my mind
You may take my eyes, but baby, I'm not blind
It all works out in time
You know I'm gonna be alright
You may take my eyes, but, baby, I'm not blind

Talk to me now

I think your mother wants me dead
Say you want it, too
I am a schizophrenic man
I wouldn't change you if I could
Say you want me, too
Treat me cold, I'll play it cool

Spiders in my head, spiders in my mind
You may take my eyes, but baby, I'm not blind
It all works out in time
You know I'm gonna be alright
You may take my eyes, but, baby, I'm not blind

Ooh, ooh, ooh, ooh
Ooh, ooh, ooh, ooh
Ooh, ooh, ooh, ooh

Spiders in my head, spiders in my mind
You may take my eyes, but baby, I'm not blind
It all works out in time
You know I'm gonna be alright
You may take my eyes, but, baby, I'm not blind"
How Are You True,Cage The Elephant,Tell Me I’m Pretty,"{'year': 2015, 'month': 12, 'day': 18}","Wake up, say a little prayer
Out of bed to the bathroom where
I take a look at myself and I stop and stare
And I wonder who is this standing here

And I try to find the will to carry on
Wonder how much longer I can carry on
Cause these days they take so long, yes they do

Hey, how are you true?
The light will guide you home, yes it will
Hey, how are you true?
Well there's one thing that you should know
Yes you should
You need love, you need love, you need love
You need love

All your days spend counting numbers
'Til one day you'll find day you'll find)
That life has passed you by
And in the quiet still of silence try to hide your eyes hide your eyes)
Oh no so don't cry, oh no

Hey, how are you true?
The light will guide you home, yes it will
Oh the years, they turn so fast
Soon the present will be past and you'll look back and laugh
Yes you will

Well I can still remember, yes, I was a young man too
Alone, but not forgotten and the candle shining through
Still all these words I've spoken don't mean anything at all
Without love, without love, without love
Without love
Do, do, do, oh yeah
Do, do, do, oh yeah

I remember clearly we were both there on the airplane
Told me all your secrets, oh I never saw it coming
I thought that you were joking
You were actually quite serious"
Take It or Leave It,Cage The Elephant,Melophobia,"{'year': 2013, 'month': 10, 'day': 8}","Baby, you should know by now that Im right for you
But every time I step to you, you change your tune
Sweet wheel of death keeps us holding our breath
I step to the right, you move to the left
And there's no one else I'd rather die to myself

Oh why won't you make up your mind?
I think I must confess, I'm starting to unwind
I've been tripping over you, so tell me something new
Take it or leave it

Maybe I should pack my things and move on
Maybe I'm fooling myself and you're already gone
Watching the flames wither and fade
Trying to make sense of the look on your face
I'm down on my knees just praying that I can hold on

Oh why won't you make up your mind?
I think I must confess, I'm learning to unwind
I've been tripping over you, so tell me something new
Take it or leave it

Baby, please, oh baby, please
Stay with me, or cut me free
Its killing me

Oh why won't you make up your mind?
I think I must confess, I'm starting to unwind
I've been tripping over you, so tell me something new
Take it or leave it
Take it or leave it"
Goodbye,Cage The Elephant,Social Cues,"{'year': 2019, 'month': 4, 'day': 8}","All my life, I read between the lines
Held on too tight, you know I tried
But in the end, it left me paralyzed
It's alright, goodbye, goodbye
Seems like yesterday I was a child
Just a ripple in the folds of time
I wish you well, I want to see you smile
It's alright, goodbye
Goodbye

Goodbye, goodbye, goodbye
I won't cry, I won't cry, I won't cry
Lord knows how hard we tried
Goodbye, goodbye, goodbye

So many things I want to say to you
So many sleepless nights I prayed for you
My heart's an ashtray and I lost my mind
You bring the smokes, I've got the time
I want to scream, I want to laugh, I want to close my eyes
I want to hide somewhere that's hard to find
Stop wasting time trying to shape your life
It's alright, goodbye
Goodbye, goodbye, goodbye

Goodbye, goodbye, goodbye
I won't cry, I won't cry, I won't cry
Lord knows how hard we tried
Goodbye, goodbye, goodbye

My pretty bird, my favorite lullaby
How'd I become the thorn in your side?
All your laughter turned into a cry
It's alright, goodbye
Goodbye, goodbye, goodbye

Goodbye, goodbye, goodbye
I won't cry, I won't cry, I won't cry
Lord knows how hard we tried
It's alright, it's alright, it's alright
It's alright, it's alright, it's alright
Goodbye, goodbye, goodbye"
Aberdeen,Cage The Elephant,"Thank You, Happy Birthday","{'year': 2011, 'month': 1, 'day': 11}","I been trying real hard to, to realize
But some things take a long, long, long, long time
Long time

Hold the phone, hit repeat
Got me foamin' at the knees
Saw the flame, tasted sin
You burn me once again
Cut the cord, she's a creep
Aberdeen!
Way back, way back, way back!

Never saw my dark side inin your eyes
Back and forth, bloody fingers painting up the sky
The sky

Hold the phone, hit repeat
Got me foamin' at the knees
Saw the flame, tasted sin
But you burn me once again
Cut the cord, she's a creep
Aberdeen!
Way back, way back, way back!

Hey! Hey! Hey!
Ooh, ooh

Hold the phone, hit repeat
Got me foamin' at the knees
Saw the flame, tasted sin
You burn me once again
Cut the cord, she's a creep
Aberdeen!
Aberdeen!
Way back, way back, way back!

Way back, way back, way back!
Way back, way back, way back
Way back, way back, way back
Way back, way back, way back
Ooh, ooh)"
