,Artist,Album,Release Date,Lyrics
Teeth,Cage The Elephant,Melophobia,"{'year': 2013, 'month': 10, 'day': 8}","Yeah, alright

Electrified harmonious
I think I'll take it out to the streets
Will somebody please help me?
Call the doctor but don't call the police
Yeah, cool

Are you into the beat?
Are you into the beat?
I can feel it in my teeth

I can feel it in my teeth
I can feel it in my teeth
And it's driving me mad
I can feel it in my teeth, ooh
I can feel it in my teeth
And it's driving me crazy
It's driving me crazy
It's driving me mad

I wish I were an astronaut
Spacecase making the scene, yeah
Put me in a hospital
Lock me up and throw out the key

Hey, hey, hey, hey
Are you into the beat?
I'm the king of the beat
I can feel it in my teeth

I can feel it in my teeth
I can feel it in my teeth
And it's driving me mad
I can feel it in my teeth
I can feel it in my teeth
And it's driving me crazy
It's driving me crazy

Now, shut up and dance

I can feel it in my teeth
I can feel it in my teeth
And it's driving me mad
I can feel it in my teeth, ooh
I can feel it in my teeth
And it's driving me crazy
It's driving me crazy
It's driving me mad
Yeah, yeah
We live in an environment whose entire population of critics and no painters to be found
Where have all the storytellers gone?
Just when did I become so eaten up by moss and covered in a cloak of popularity?
And then I lose my voice in between the echoes of selfserving prophecy
A captain without his ship, a chiefa chief without a tribe
A raging megalomaniac who only speaks to hear his cheeks slap together and worship the sound of his own voice
A muffled crya muffled crya muffled crya muffled cry
Power concaved inside a woman
To configure through the mythical power of the trees, the graphics being paper th—
Paper thin garments and garments and garments and garments and garments and garments and garments and garments
Pray for summer days
The rain and wind is so strong outside my window
And winter's always searching for another
I hearI hear his cheeks slap together and worship his own voice
Loulouder? Okay, alright
I'm so tired of the demands of this world, her nagging voice
The song she sings, the songs that she desires
She cries out in the heat of her passions
Her legs spread ready forready for a stranger
The captain without his ship, a chief witha chief without a tribe
A raging megalomaniac who only speaks to hear his cheeks slap together and worship the sound of his own voice
I dare not take another drink until it's gone
Just when did I become so eaten up by moss and covered in a cloak of popularity?
When I lose my voice in between the echoes of selfserving prophecy"
Skin and Bones,Cage The Elephant,Social Cues,"{'year': 2019, 'month': 4, 'day': 19}","Close my eyes and drift into the silence
Barely see the ultraviolet
Slipped and fell into the deep end
Oh, the sidewalk shimmer just like diamonds
All the empty words were flying
Well, the heart was low, but I never was alone
I never was alone

I've been running for so long
All that's left is skin and bones
Close my eyes, fight to carry on
Sometimes it makes no sense at all
If I stumble, will I fall?
If I fall, I'll tuck and roll
Close my eyes and let the lovelight guide me home
Let the lovelight guide me home

One step fades and falls into another
I'm not getting any further
Left here feeling like an alien
All the shiny sidewalks, they were lying
Lost myself while I was hiding
And the heart was low, but I never was alone
I never was alone

I've been running for so long
All that's left is skin and bones
Close my eyes, fight to carry on
Sometimes it makes no sense at all
If I stumble, will I fall?
If I fall, I'll tuck and roll
Close my eyes and let the lovelight guide me home
Let the lovelight guide me home

Heart's so empty almost all the time
Blind devising ways to lead the blind
And it seems as if there's no end in sight
I don't wanna be there when it all goes down
But if I gotta be there, don't let me hit the ground
Can I hit the ground?

I've been running for so long
All that's left is skin and bones
Close my eyes, fight to carry on
Sometimes it makes no sense at all
If I stumble, will I fall?
If I fall, I'll tuck and roll
Close my eyes and let the lovelight guide me home
Let the lovelight guide me home
Let the lovelight guide me home"
Hypocrite,Cage The Elephant,Melophobia,"{'year': 2013, 'month': 10, 'day': 8}","Tonight, bleeding from the holes in my face
But I don't want to give it away
You did it for the family name
Crash collide into space
You, your favorite color, red
I guess that I'm the hypocrite
You're not responsible
I'm responsible

Who's to blame?
Tell me, who's to blame?
Tell me who

I won't ever do that again, I've been all over the place
I watched the strawberry fields dry up and wither away
And if you ask me to stay, you know that's where I will be
Won't ever do that again, don't wanna do that again

You call me Baby Blue
For all the evil schemes I pull
We sit and watch the waves break
I made a lot of mistakes
Crash collide into space

Who's to blame?
Tell me, who's to blame?
Tell me who

I won't ever do that again, I've been all over the place
I watched the strawberry fields dry up and wither away
And if you ask me to stay, you know that's where I will be
Won't ever do that again, don't wanna do that again

Ahooh
Ahooh
Ahooh

I won't ever do that again, I've been all over the place
I watched the strawberry fields dry up and wither away
And if you ask me to stay, you know that's where I will be
Dont wanna dododododododododo that again

Ahooh
Ahooh
Ahooh"
Broken Boy,Cage The Elephant,Social Cues,"{'year': 2019, 'month': 4, 'day': 19}","I was born on the wrong side of the train tracks
I was raised with a strap across my back
Lay me on my side or hold me up to the light, yeah
I was burned by the cold kiss of a vampire
I was bit by the whisper of a soft liar
Any good friend of yours is a good friend of mine

Broken boy, how does it feel?
Broken boy, how does it feel? How does it feel?

Tell me why I'm forced to live in this skin
Tell me why Im forced to live in this skin
I'm an alien, I'm just an alien, oh
Tell me why I was born to live in this skin
Tell me how Im supposed to be forgiven
With my hand in the hive and the sun in my eyes, yeah

Broken boy, how does it feel?
Broken boy, how does it feel? How does it feel?

I was born on the wrong side of the train tracks
Always born on the wrong side of the train tracks
Lay me on my side or hold me up to the light, yeah
I was burned by the cold kiss of a vampire
I was promised the keys to an empire
Any good friend of yours is a good friend of mine, oh

Broken boy, how does it feel?
Broken boy, how does it feel? How does it feel?"
Night Running,Cage The Elephant,Social Cues,"{'year': 2019, 'month': 3, 'day': 28}","We're on a night run
Boy you better hold your tongue
Talking like you're coming from kingdom come
Rhythm and reeling, the feeling I'm riding
The sound through the ceiling
Never got no money
But I'm running from the gun
My engines flooded
Cold blooded no money
Drunk on something, uh
Killing the moonlight with daylight
I got my Xray eyes
And I'm feeling so fine

Night running, all night running We running)
Starstudded, not far from it We roll)
We're running, all night running We running)
Cold blooded, all night running We roll)
Night running, all night running We running)
Starstudded, not far from it We roll)
Night running, all night running We running)
Cold blooded, we're all night running We roll)

We're on the nightshade
Tell me what we're hiding from
Like someone could steal it
Are we waiting for some kind of feeling
Or saving it up for the morning?
Undercover
The cloak and dagger
Is there a creature in the attic?
Are we for real, yeah?
Or just pretending?
Will it burn out by the morning?

Night running, all night running We running)
Starstudded, not far from it We roll)
We're running, all night running We running)
Cold blooded, all night running We roll)
Night running, all night running We running)
Starstudded, not far from it We roll)
Night running, all night running We running)
Cold blooded, we're all night running We roll)

We're on a night run
No telling who we're running from
In a world of secrets and demons and people hiding from the sun
Sending my message to everyone losing control
Better not stop 'til I get home
Sentimental flowers don't grow
Got to live through tidal waves
And parishes and biblical floods
I got the grisgris love
And the streets in my blood
I'm on the final run
Falling in and out of love, oh

Night running, all night running We running)
Starstudded, not far from it We roll)
We're running, all night running We running)
Cold blooded, all night running We roll)
Night running, all night running We running)
Starstudded, not far from it We roll)
Night running, all night running We running)
Cold blooded, we're all night running We roll)"
In One Ear,Cage The Elephant,Cage The Elephant,"{'year': 2008, 'month': 6, 'day': 23}","They say that we ain't got the style, we ain't got the class
We ain't got the tunes that's gonna put us on the map
And I'm a phony in disguise, tryna make the radio
I'm an antisocial anarchist who sound like soandso
They say I'm just a stupid kid, another crazy radical
Rock 'n' roll is dead, I probably should have stayed at school
Another Generation X who somehow slipped up through the cracks
Oh, they'd love to see me fall, but I'm already on my back

So it goes in one ear and right out the other
People talking shit, but you know I never bother
It goes in one ear and right out the other
People talking shit, they can kiss the back of my hand

Now I know I'm not a saint, I've been a sinner all my life
I ain't tryin' to hide my flaws, I'd rather keep them in the light
They want to criticize, scrutinize, cast another stone
Burn me at the stake and sit and watch it from their throne
They say the devil is my pal, I do a lot of drugs
The crowd will only like me if they're really fucking drunk
They think they know my thoughts, but they don't know the least
If they'd listen to the words they'd find a message tucked beneath

But it goes in one ear and right out the other
People talking shit even though they never bother
It goes in one ear and right out the other
People talking shit, they can kiss the back of my hand

You hear that? You hear what's coming?
Oh, you better run for the hills
'Cause we're coming to your town
And we're gonna burn that motherfucker down
Aaaaaaoooh!!!!

Here's the moral to the story: we don't do it for the glory
We don't do it for the money, we don't do it for the fame
So all the critics who despise us, go ahead and criticize us
It's your tyranny that drives us, adds the fire to our flames

And it goes in one ear and right out the other
People talking shit but you know we never bother
It goes in one ear and right out the other
I'm only playing music cause you know I fucking love it
It goes in one ear and right out the other
People talking shit but you know I never bother
It goes in one ear and right out the other
People talking shit, they can kiss the back of my hand"
Mess Around,Cage The Elephant,Tell Me I’m Pretty,"{'year': 2015, 'month': 10, 'day': 29}","Oh no, oh no, oh no, oh no

Ahhhhh oh no)
Ahhhhh oh no)
Ahhhhh oh no)
No, she don't mess around
No, she don't mess around

Oh St. Louis, California
Blue eyes, yeah, she's comin' for ya
Land of Mary, Charm City
Oh lord, wish she was my baby
You know she'll drive you crazy
Yeah, she's comin' for ya
No, she don't mess around
No, she don't mess around

No, she don't mess around
No, she don't mess around

The heat is rising and only getting hotter, ready to blow
I think I'll pour myself a glass of water, let it flow
She'll show you what she's made of
Yeah, she's comin' for ya
She's gonna try to break ya
Yeah, she's comin' for ya
No, she don't mess around
No, she don't mess around

Ahhhhh oh no)
Ahhhhh oh no)
Ahhhhh oh no)
No, she don't mess around
No, she don't mess around

Oh no, oh no, oh no, oh no

Ahhhhh oh no)
Ahhhhh oh no)
Ahhhhh oh no)
No, she don't mess around
No, she don't mess around

Ahhhhh oh no)
Ahhhhh oh no)
Ahhhhh oh no)
No, she don't mess around
No, she don't mess around

No, she don't mess around"
Halo,Cage The Elephant,Melophobia,"{'year': 2013, 'month': 10, 'day': 8}","Every time I get away, you find a way to reel me back in, aah
Tell me that you love me, hold me tight so we can always be friends, aah
I swear, I said it before and I'll say it again! Aah
Every time I get away, you find a way to pull me back in, aah

Why does it take so long?
Why does it feel so wrong?
Why does it take so long?

You knew I couldn't help myself
I had to lay low
Got so high, couldn't help myself
I lost my halo

Took me by the hand and said remember all the good times we had, aah
I remember how you took my favorite knife and slipped it under my skin, aah
I swear, I said it before and I'll say it again! Aah
Every time I get away, you find a way back under my skin

Why does it take so long?
Why does it feel so wrong?

You knew I couldn't help myself
I had to lay low
Got so high, couldn't help myself
I lost my halo

All my life with a skeleton
I had to let go
Got so high, couldn't help myself
I lost my halo
I lost my halo
I lost my halo"
Cry Baby,Cage The Elephant,Tell Me I’m Pretty,"{'year': 2015, 'month': 12, 'day': 18}","I think it's pretty strange
Watching the passersby
Crawling all over one another
Trying to get ahead in life

Monday, you cough
Tuesday, you cry
Wednesday in bed
What if you die?

You say that I'm insane
I say you're probably right
We all got something important to say
But talking's a waste of time

Monday, you cough
Tuesday, you cry
Wednesday in bed
What if you die?

Cry, baby, cry
Kick, scream, fight, hold on with all your might
You're gonna die, die
Open up your eyes or life will pass you by

Don't you think it's pretty strange?
All got something to hide
House in the desert, top of a mountain
Lost in a deepsea dive

Monday, you cough
Tuesday, you cry
Wednesday in bed
Thursday, you die

Cry, baby, cry
Kick, scream, fight, hold on with all your might
You're gonna die, die
Open up your eyes or life will pass you by
Without love, without love
Nothing else will ever be enough

Cry, baby, cry
Like it or not, like it or not
It's a matter of time
Cry, baby, cry
Like it or not, like it or not
It's a matter of time
It's a matter of time"
Right Before My Eyes,Cage The Elephant,"Thank You, Happy Birthday","{'year': 2011, 'month': 1, 'day': 11}","Timber shakes these trails; they all derail
Phony, false, and frail
An empty ocean lost our way with no direction home
Golden needles, names we take in vain
Find it harder to remain
No, nothing's sacred still waiting on that explanation

Right before my eyes
I saw the whole world lose control
The whole world lost control
Before my eyes, uhhuh
I fell through the floor
I couldn't take it anymore
I can't take this anymore
It breaks my mind,, uhhuh

Holding dirty hands over the flames
Getting pleasure from the pain
Softly screaming the pistol that you raised has spoken
Golden needles names we take in vain
Find it harder to remain
No, nothing's sacred still waiting on that explanation

Right before my eyes
I saw the whole world lose control
The whole world lost control
Before my eyes uhhuh
I fell through the floor
I couldn't take it anymore
I can't take this anymore
It breaks my mind uhhuh

Everything I thought I knew fell to the side
Time went on and on I couldn't see past my own eyes
Past my eyes
Past my eyes
Past my eyes

Right before my eyes
I saw the whole world lose control
The whole world lost control
Before my eyes uhhuh
I fell through the floor
I couldn't take it anymore
I can't take this anymore
It breaks my mind uhhuh"
House of Glass,Cage The Elephant,Social Cues,"{'year': 2019, 'month': 3, 'day': 8}","Climb into my corner, my self inflicted coma
Stand up, lay down, repeat in the same order
Fall straight through the floor and let the time just run me over
Another mirrored image corrupted and distorted
I'm underwhelmed, uninterested, I wonder why I'm over it
Walk it off, the kettle's black
The dotted line, the house is glass

The house is glass) The house is glass
The house is glass) The house is glass

It's an illusion, this admiration
Of mutilation, my isolation
It's an illusion, this admiration
Of mutilation, my isolation, my isolation
My isolation, it's an illusion

Slide on down the staircase, that pictureperfect moment
Receiver projected, act like if you own it
Smile for the camera, repeat and do it over
Smile for the camera, repeat and do it over
Joke's on you, the needle prick
Cut me down, I need a break
Walk it off, the kettle's black
The dotted line, this house is glass

The house is glass) The house is glass
The house is glass) The house is glass

It's an illusion, this admiration
Of mutilation, my isolation
It's an illusion, this admiration
Of mutilation, my isolation, my isolation
My isolation, it's an illusion

Brick by brick
Make it last
Hit that line
The house is glass


It's an illusion, my isolation
My isolation, my isolation
It's an illusion, it's an illusion
My isolation, my isolation, my isolation"
Tokyo Smoke,Cage The Elephant,Social Cues,"{'year': 2019, 'month': 4, 'day': 19}","Hey man
Hand me down with the crooked back
What's your father's name? Boy, you don't know where you're at
Pick yourself up, you don't look so good
Maybe you should lay down
Taught me how to fall
But you never told me I was supposed to stay down

Stick and move
Sharpen up the knife
Keep it tight
Stay between the lines
Make your mark
Take your own advice
Don't be surprised when you trip and stumble
I played the fool again
My old unfaithful friend
Stick and move
Sharpen up the knife
Don't be surprised if you can't stay between the lines

Quicksand color blind in the hourglass
All spun out 'cause you can't stop looking back
Better stay still, don't you make a move
What'd you hope to find here?
Taught me how to fall
But you never told me I was meant to die here

Stick and move
Sharpen up the knife
Keep it tight
Stay between the lines
Make your mark
Take your own advice
Don't be surprised when you trip and stumble
I played the fool again
My old unfaithful friend
Stick and move
Sharpen up the knife
Don't be surprised if you can't stay between the lines

Endless shot rounds
No smoking guns
Fizzled and faded
Now back on the run
My sticks and stones
Tokyo smoke
I played the fool 'til I started to choke
My public smile
My double face
Half in the light
Half in the shade
Need some fresh air
No place tonight
Guess I'll stay in and continue to fight
Lost, trace of trail
Spiderweb spun
Pale white and blue
Now I'm coming undone
Play sticks and stones
Three shades of black
Two steps away
And I can't get back"
Back Against the Wall,Cage The Elephant,Cage The Elephant,"{'year': 2009, 'month': 2, 'day': 2}","Tonight, I'll have a look and try to find my face again
Buried beneath this house, my spirit screams and dies again
Out back, a monster wears a cloak of Persian leather
Behind the TV screen, I've fallen to my knees

I said, you've got me where you want me again and I can't turn away
I'm hanging by a thread and I'm feeling like I'll fall
I'm stuck here in between these shadows of my yesterday
I want to get away, I need to get away

Blanket of silence makes me want to sink my teeth in deep
Burn all the evidence of fabricated disbelief
Pull back the curtains, took a look into your eyes
My tongue has now become a platform for your lies

I said, you've got me where you want me again and I can't turn away
I'm hanging by a thread and I'm feeling like I'll fall
I'm stuck here in between these shadows of my yesterday
I want to get away, I need to get away

Now you know, yeah, you've got my back against the wall
Oh God, I ain't got no other place to hide
Chained down, like a sitting duck just waiting for the fall
You know, yeah, you've got my back against the wall

Deep in the jungle, camouflaged by all the fallen leaves
A hand holds up the sky while, shamefully, I make my plea
The altar's calling, but my legs won't seem to stand
Guess I'm a coward scared to face the man I am

I said, you've got me where you want me again and I can't turn away
I'm hanging by a thread and I'm feeling like I'll fall
I'm stuck here in between these shadows of my yesterday
I want to get away, I need to get away

Now you know, yeah, you've got my back against the wall
Oh God, I ain't got no other place to hide
Chained down, like a sitting duck just waiting for the fall
You know, yeah, you've got my back against the wall
Now you know, yeah, you've got my back against the wall
Oh God, I ain't got no other place to hide
Chained down, like a sitting duck just waiting for the fall
You know, yeah, you've got my back against the wall"
Punchin’ Bag,Cage The Elephant,Tell Me I’m Pretty,"{'year': 2015, 'month': 12, 'day': 18}","She's a stonecold straightfaced killer and a lover
And she won't put up with another brute who only wants to bruise her
Take her love and then abuse her

She won't take no more, won't take no more
Won't take no more, won't take no more

Oh no, ain't it a drag
If you take a swing, does she swing back?
She say, I'm not your punchin' bag""

Heaven help ya, I'm telling the truth
Heaven help ya, she's coming for you
Heaven help ya, the girl likes to fight
Afraid of nothing and she carries a knife

She said, Oh no) I'm not your punchin' bag
Oh no) I'm not your punchin' bag
I'm not your punchin' bag""

What kind of man are you?
Instead of kisses, you gave bruises
No more time for cheap excuses
If I were you, I would be leaving
Best you go while you're still breathing

She won't take no more, won't take no more
Won't take no more, won't take no more

Oh no, ain't it a drag
If you take a swing, the kid swings back
She say, I'm not your punchin' bag""

Heaven help ya, I'm telling the truth
Heaven help ya, she's coming for you
Heaven help ya, the girl likes to fight
Afraid of nothing and she carries a knife

She said, Oh no) I'm not your punchin' bag
Oh no) I'm not your punchin' bag
Oh no) I'm not your punchin' bag""

Last time, last time you're ever gonna
Last time, last time you're ever gonna
Last time, last time you're ever gonna
Last time, last time you're ever gonna
Oh no, ain't it a drag
Everywhere you go, better watch your back
'Cause I'm not your punchin' bag""

Heaven help ya, I'm telling the truth
Heaven help ya, she's coming for you
Heaven help ya, the girl likes to fight
Afraid of nothing and she carries a knife

She said, I'm not your punchin' bag
I'm not your punchin' bag
I'm not your punchin' bag"""
Instant Crush (Unpeeled),Cage The Elephant,Unpeeled,"{'year': 2017, 'month': 7, 'day': 28}","I didn't want to be the one to forget
I thought of everything I'd never regret
A little time with you is all that I get
That's all we need because it's all we can take
One thing I never see the same when you're 'round
I dont believe in him — his lips on the ground
I wanna take you to that place in the Roche”
But no one gives us any time anymore
He ask me once if Id look in on his dog
You made an offer for it, then you ran off
I got this picture of us kids in my head
And all I hear is the last thing that you said

'I listened to your problems
Now listen to mine'
I didn't want to anymore, oh oh ohh

And we will never be alone again
Cause it doesn't happen every day
Kinda counted on you being a friend
Can I give it up or give it away
Now I thought about what I wanna say
But I never really know where to go
So I chained myself to a friend
Some more again

It didn't matter what they wanted to see
He thought he saw someone that looked just like me
The summer memory that just never dies
We worked too long and hard to give it no time
He sees right through me, it's so easy with lies
Cracks in the road that I would try and disguise
He runs his scissor at the seam in the wall
He cannot break it down or else he would fall
One thousand lonely stars
Hiding in the cold
Take it, I don't wanna sing anymore

'I listened to your problems
Now listen to mine'
I didn't want to anymore, oh oh ohh

And we will never be alone again
Cause it doesn't happen every day
Kinda counted on you being a friend
Can I give it up or give it away
Now I thought about what I wanna say
But I never really know where to go
So I chained myself to a friend
Cause I don't know what else I can do
And we will never be alone again
Cause it doesn't happen every day
Kinda counted on you being a friend
Can I give it up or give it away
Now I thought about what I wanna say
But I never really know where to go
So I chained myself to a friend
Cause I don't know what else I...
I don't understand, don't get upset I'm not with you...
Were swimming around, it's all I do
When I'm with you
And we will never be alone again
Cause it doesn't happen every day
Kinda counted on you being a friend
Can I give it up or give it away
Now I thought about what I wanna say
But I never really know where to go
So I chained myself to a friend
Cause I don't know what else I can do
And we will never be alone again
Cause it doesn't happen every day
Kinda counted on you being a friend
Can I give it up or give it away
Now I thought about what I wanna say
But I never really know where to go
So I chained myself to a friend
Cause I don't know what else I can do"
