,Artist,Album,Release Date,Lyrics
Rainbow,Kacey Musgraves,Golden Hour,"{'year': 2019, 'month': 2, 'day': 11}","When it rains, it pours
But you didn't even notice
It ain't rainin' anymore
It's hard to breathe when all you know is
The struggle of stayin' above the risin' water line

Well, the sky has finally opened
The rain and wind stopped blowin'
But you're stuck out in the same ol' storm again
You hold tight to your umbrella
Well, darlin', I'm just tryin' to tell ya
That there's always been a rainbow
Hangin' over your head

If you could see what I see
You'd be blinded by the colors
Yellow, red, and orange, and green
And at least a million others
So tie up the boat, take off your coat
And take a look around

'Cause the sky has finally opened
The rain and wind stopped blowin'
But you're stuck out in the same ol' storm again
You hold tight to your umbrella
Well, darlin', I'm just tryin' to tell ya
That there's always been a rainbow
Hangin' over your head

Oh, tie up the boat, take off your coat
And take a look around
Everything is alright now

'Cause the sky has finally opened
The rain and wind stopped blowin'
But you're stuck out in the same ol' storm again
Let go of your umbrella
'Cause, darlin', I'm just tryin' to tell ya
That there's always been a rainbow
Hangin' over your head
Yeah, there's always been a rainbow
Hangin' over your head

Mmm
It'll all be alright"
Butterflies,Kacey Musgraves,Golden Hour,"{'year': 2018, 'month': 2, 'day': 23}","I was just coastin', never really goin' anywhere
Caught up in a web, I was gettin' kinda used to stayin' there
And out of the blue
I fell for you

Now, you're lifting me up 'stead of holding me down
Stealing my heart 'stead of stealing my crown
Untangled all the strings 'round my wings that were tied
I didn't know him and I didn't know me
Cloud Nine was always out of reach
Now, I remember what it feels like to fly
You give me butterflies

Kiss full of color makes me wonder where you've always been
I was hiding in doubt 'til you brought me out of my chrysalis
And I came out new
All because of you

And now, you're lifting me up 'stead of holding me down
Stealing my heart 'stead of stealing my crown
Untangled all the strings 'round my wings that were tied
I didn't know him and I didn't know me
Cloud Nine was always out of reach
Now, I remember what it feels like to fly
You give me butterflies, yeah
You give me butterflies

Ooh, mm, mm

Now, you're lifting me up 'stead of holding me down
You're taking my hand 'stead of taking my crown
Untangled all the strings 'round my wings that were tied
I didn't know him and I didn't know me
Cloud Nine was always out of reach
Now, I remember what it feels like to fly
You give me butterflies Mm)
You give me butterflies Mm)"
Slow Burn,Kacey Musgraves,Golden Hour,"{'year': 2018, 'month': 3, 'day': 30}","Born in a hurry, always late
Haven't been early since '
Texas is hot, I can be cold
Grandma cried when I pierced my nose
Good in a glass, good on green
Good when you're puttin' your hands all over me

I'm alright with a slow burn
Taking my time, let the world turn
I'm gonna do it my way, it'll be alright
If we burn it down and it takes all night
It's a slow burn, yeah

In Tennessee, the sun's goin' down
But in Beijing, they're headin' out to work
You know the bar down the street don't close for an hour
We should take a walk and look at all the flowers

'Cause I'm alright with a slow burn
Taking my time, let the world turn
I'm gonna do it my way, it'll be alright
If we burn it down and it takes all night
It's a slow burn

Mm, whatever feels good
Ah, ah, ah, ah
Mm

Old soul, waitin' my turn
I know a few things, but I still got a lot to learn
So I'm alright with a slow burn, slow burn, slow burn
Mm, I'm alright with a slow burn"
Golden Hour,Kacey Musgraves,Golden Hour,"{'year': 2018, 'month': 3, 'day': 30}","All that I know
Is you caught me at the right time
Keep me in your glow
'Cause I'm having such a good time
With you

Baby, don't you know?
That you're my golden hour
The color of my sky
You've set my world on fire
And I know, I know everything's gonna be alright

I used to get sad
And lonely when the sun went down
But it's different now
'Cause I love the light that I've found
In you

Baby, don't you know?
That you're my golden hour
The color of my sky
You've set my world on fire
And I know, I know everything's gonna be alright

You make the world look beautiful, ooh
I thought I'd seen it all before
But looking through your eyes
It looks like paradise

You've set my world on fire, yeah
And I know, I know everything's gonna be alright
You're my golden hour
The color of my sky
You've set my world on fire
And I know, I know everything's gonna be alright
Yeah, I know, I know everything's gonna be alright
Golden hour"
Space Cowboy,Kacey Musgraves,Golden Hour,"{'year': 2018, 'month': 2, 'day': 23}","You look out the window while I look at you
Saying I don't know would be like saying that the sky ain't blue
And boots weren't made for sitting by the door
Since you don't wanna stay anymore

You can have your space, cowboy
I ain't gonna fence you in
Go on, ride away in your Silverado
Guess I'll see you 'round again
I know my place, and it ain't with you
Well sunsets fade, and love does, too
Yeah, we had our day in the sun
When a horse wants to run, there ain't no sense in closing the gate
You can have your space, cowboy

After the gold rush, there ain't no reason to stay
Shoulda learned from the movies that good guys don't run away
But roads weren't made to not go down
And there ain't room for both of us in this town

So you can have your space, cowboy
I ain't gonna fence you in
Go on, ride away in your Silverado
I'll see you around again
'Cause I know my place, and it ain't with you
Sunsets fade, and love does, too
We had our day in the sun
When a horse wants to run, ain't no sense in closing the gate
So you can have your space

You can have your space, cowboy
I ain't gonna fence you in
Go on, ride away in your Silverado
I'll see you around again
'Cause I know my place, and it ain't with you
Sunsets fade, and love does, too
Though we had our day in the sun
When a horse wants to run, ain't no sense in closing the gate
You can have your space
Yeah, you can have your space
You can have your space, cowboy"
Deeper Well,Kacey Musgraves,Deeper Well,"{'year': 2024, 'month': 2, 'day': 8}","My Saturn has returned
When I turned twentyseven
Everything started to change
Took a long time, but I learned
There's two kinds of people, one is a giver
And one's always tryin' to take
All they can take

So I'm sayin' goodbye to the people that I feel
Are real good at wastin' my time
No regrets, baby, I just think that maybe
You go your way and I'll go mine
It's been a real good time
But you got dark energy, somethin' I can't unsee
And I've got to take care of myself
I found a deeper well

I used to wake and bake
Roll out of bed, hit the gravity bong that I made
And start the day
For a while it got me by
Everything I did seemed better when I was high
I don't know why

So I'm gettin' rid of the habits that I feel
Are real good at wastin' my time
No regrets, baby, I just think that maybe
It's natural when things lose their shine
So other things can glow
I've gotten older now, I know
How to take care of myself
I found a deeper well
Mm

When I was growing up
We had what we needed, shoes on our feet
But the world was as flat as a plate
And that's okay

The things I was taught only took me so far
Had to figure the rest out myself
And then I found
I found a deeper well
Mm
Mm"
Merry Go ’Round,Kacey Musgraves,Same Trailer Different Park,"{'year': 2012, 'month': 9, 'day': 10}","If you ain't got two kids by twentyone
You're probably gonna die alone
At least that's what tradition told you
And it don't matter if you don't believe
Come Sunday morning you best be
There in the front row, like you're s'posed to

Same hurt in every heart
Same trailer, different park
Mama's hooked on Mary Kay
Brother's hooked on Mary Jane
And Daddy's hooked on Mary two doors down
Mary, Mary, quite contrary
We get bored so we get married
And just like dust, we settle in this town
On this broken merry go 'round
And 'round and 'round we go
Where it stops, nobody knows
And it ain't slowin' down
This merry go 'round

We think the first time's good enough
So we hold on to high school love
Say we won't end up like our parents
Tiny little boxes in a row
Ain't what you want, it's what you know
Just happy in the shoes you're wearin'

Same checks we're always cashin'
To buy a little more distraction

'Cause Mama's hooked on Mary Kay
Brother's hooked on Mary Jane
And Daddy's hooked on Mary two doors down
Mary, Mary, quite contrary
We get bored so we get married
And just like dust, we settle in this town
On this broken merry go 'round
And 'round and 'round we go
Where it stops, nobody knows
And it ain't slowin' down
This merry go 'round


Mary, Mary, quite contrary
We're so bored until we're buried
And just like dust we settle in this town
On this broken merry go 'round
Merry go 'round
Jack and Jill went up the hill
Jack burned out on booze and pills
And Mary had a little lamb
Mary just don't give a damn no more"
Follow Your Arrow,Kacey Musgraves,Same Trailer Different Park,"{'year': 2013, 'month': 10, 'day': 21}","If you save yourself for marriage, you're a bore
If you don't save yourself for marriage, you're a horrible person
If you won't have a drink, then you're a prude
But they'll call you a drunk as soon as you down the first one
If you can't lose the weight, then you're just fat
But if you lose too much, then you're on crack
You're damned if you do and you're damned if you don't
So, you might as well just do whatever you want
So make lots of noise Hey)
Kiss lots of boys Yeah)
Or kiss lots of girls, if that's somethin' you're into
When the straight and narrow gets a little too straight
Roll up a joint, or don't
Just follow your arrow wherever it points, yeah
Follow your arrow wherever it points

If you don't go to church, you'll go to Hell
If you're the first one on the front row, you're a selfrighteous son of a
Can't win for losin', you'll just disappoint 'em
Just 'cause you can't beat 'em, don't mean you should join 'em

So make lots of noise Hey)
Kiss lots of boys Yeah)
Or kiss lots of girls, if that's somethin' you're into
When the straight and narrow gets a little too straight
Roll up a joint, or don't
Just follow your arrow wherever it points, yeah
Follow your arrow wherever it points

Say what you think Say what you think)
Love who you love Love who you love)
'Cause you just get so many trips around the sun
Yeah, you only, only live once

So make lots of noise Hey)
Kiss lots of boys Yeah)
Or kiss lots of girls, if that's what you're into
When the straight and narrow gets a little too straight
Roll up a joint, I would
And follow your arrow wherever it points, yeah
Follow your arrow wherever it points"
Happy & Sad,Kacey Musgraves,Golden Hour,"{'year': 2018, 'month': 3, 'day': 30}","It's not you, it's the glow of the party
The way that you've got me lit up inside
It's the song that they're playin', the words that you're sayin'
It's never felt so right

And I'm the kind of person who starts getting kinda nervous
When I'm having the time of my life

Is there a word for the way that I'm feeling tonight?
Happy and sad at the same time
You got me smiling with tears in my eyes
I never felt so high
No, I've never been this far off of the ground
And they say everything that goes up must come down
But I don't wanna come down

So is there a way to stop all this thinkin', just keep on drinkin'?
'Cause I don't wanna wake up
When they're turnin' the lights on and it turns out the joke's on me
'Cause it feels so right

And I'm the kind of person who starts getting kinda nervous
When I'm having the time of my life

Is there a word for the way that I'm feeling tonight?
Happy and sad at the same time
You got me smilin' with tears in my eyes
I never felt so high
No, I've never been this far off of the ground
And they say everything that goes up must come down
But I don't wanna come down

I don't mind at all, no, I'm used to fallin'
I'm comfortable when the sky is gray
But when everything is perfect, I start hidin'
'Cause I know that rain is comin' my way, my way

'Cause I'm happy and sad at the same time
You got me smilin' with tears in my eyes
I never felt so high
No, never been this far off of the ground
And they say everything that goes up, goes up must come down
And I don't wanna come down
No, I don't wanna come down"
High Horse,Kacey Musgraves,Golden Hour,"{'year': 2018, 'month': 3, 'day': 22}","Oh, I bet you think you're John Wayne
Showin' up and shootin' down everybody
You're classic in the wrong way
And we all know the end of the story

'Cause everyone knows someone who kills the buzz
Every time they open up their mouth
Yeah, everyone knows someone who knows someone
Who thinks they're cooler than everybody else

And I think we've seen enough, seen enough
To know that you ain't ever gonna come down
So, why don't you giddy up, giddy up
And ride straight out of this town?
You and your high horse, mmmmmm
You and your high horse, mmmmmm

I bet you think you're first place, yeah
Someone should give you a ribbon
And put you in the hall of fame
For all the games that you think that you're winning

'Cause everyone knows someone who kills the buzz
Every time they open up their mouth
Yeah, everyone knows someone who knows someone
Who thinks they're cooler than everybody else

And I think we've seen enough, seen enough
To know that you ain't ever gonna come down
So, why don't you giddy up, giddy up
And ride straight out of this town?
You and your high horse, mmmmmm
You and your high horse, mmmmmm

Darlin', you take the high horse and I'll take the high road
Mmmmmm
If you're too good for us, you'll be good riding solo

Yeah, I think we've seen enough, seen enough
To know that you ain't ever gonna come down
So, why don't you giddy up, giddy up
And ride straight out of this town?
You and your high horse, mmmmmm
You and your high horse, mmmmmm
High horse, mmmmmm
You ain't ever gonna come down
You ain't ever gonna come down"
​justified,Kacey Musgraves,star-crossed,"{'year': 2021, 'month': 8, 'day': 27}","It was a fun, strange summer
I rolled on, didn't think of you
We lost touch with each other
Fall came and I had to move

Movin' backwards, hurt comes after
Healin' doesn't happen in a straight line

If I cry just a little and then laugh in the middle
If I hate you and I love you, and then I change my mind
If I need just a little more time to deal with the fact
That you shoulda treated me right
Then I'm more than just a little justified
Mm, mm
I'm more than just a little justified

To touch somebody
You know I tried to make that you
And when you lied, said you didn't want me
Tell me, what was I supposed to do?

Movin' onwards, feelin' strong, but
Healin' doesn't happen in a straight line

If I cry just a little and then laugh in the middle
If I hate you and I love you, and then I change my mind
If I need just a little more time to deal with the fact
That you shoulda treated me right
Then I'm more than just a little justified
Mm, mm
I'm more than just a little justified

If I die just a little, inside just a little
If I want you and I call you, then I change my mind
If I need just a little more time to deal with the fact
That I shoulda treated you right
I'm more than just a little

If I cry just a little and then laugh in the middle
And I hate you and I love you, and then I change my mind A million times)
If I need just a little more time to deal with the fact
That you shoulda treated me right
Then I'm more than just a little justified
Mm, mm
I'm more than just a little justified"
"Oh, What a World",Kacey Musgraves,Golden Hour,"{'year': 2018, 'month': 3, 'day': 30}","Oh, what a world, I don't wanna leave
There's all kinds of magic; it's hard to believe
Oh, what a world, I don't wanna leave
There's all kinds of magic; it's hard to believe

Northern lights in our skies
Plants that grow and open your mind
Things that swim with a neon glow
How we all got here, nobody knows

These are real things
These are real things

Oh, what a world, don't wanna leave
All kinds of magic all around us; it's hard to believe
Thank God it's not too good to be true
Oh, what a world, and then there is you

Did I know you once in another life?
Are we here just once or a billion times?
Well, I wish I knew, but it doesn't matter
'Cause you're here right now, and I know what I feel

And these are real things
Yeah, these are real things

Oh, what a world, don't wanna leave
All kinds of magic all around us; it's hard to believe
Thank God it's not too good to be true
Oh, what a world, and then there is you
Oh, and then there is you

These are real things
These are real things

Oh, what a world, all kinds of magic
Tell me it's not too good to be true
Oh, what a world, and then there is you

Oh, what a world, I don't wanna leave
There's all kinds of magic; it's hard to believe
And then there is you)
Oh, what a world, I don't wanna leave
There's all kinds of magic; it's hard to believe
And then there is you)
Oh, what a world, I don't wanna leave
There's all kinds of magic; it's hard to believe
And then there is you)
Oh, what a world, I don't wanna leave
There's all kinds of magic; it's hard to believe"
​breadwinner,Kacey Musgraves,star-crossed,"{'year': 2021, 'month': 9, 'day': 10}","Here's what he'll do, he'll play it cool
When he hangs out with a woman like you
Say he ain't pressed by all your success
Tell you he's different than all of the rest

You're gonna give it all and give it all
But you won't get it back
I'm tellin' you, it's gonna hurt
Stay away from a boy like that

He wants a breadwinner
He wants your dinner
Until he ain't hungry anymore
He wants your shimmer
To make him feel bigger
Until he starts feelin' insecure
I wish somebody would've told me the truth
Say, He's never gonna know what to do
With a woman like you
With a woman like you""

I see the games a mile away
They only end when another heart breaks
But all of his wounds ain't an excuse
For you to put up with how he treats you

You're gonna give it all and give it all
But you won't get it back
I'm tellin' you, it's gonna hurt
Stay away from a boy like that

He wants a breadwinner
He wants your dinner
Until he ain't hungry anymore
He wants your shimmer
To make him feel bigger
Until he starts feelin' insecure
I wish somebody would've told me the truth
Say, He's never gonna know what to do
With a woman like you
With a woman like you""

I can sleep at night
Knowing I really tried
I put in the time
But the fault isn't mine

That he wants a breadwinner
He wants your dinner
Until he ain't hungry anymore Anymore)
He wants a breadwinner
He wants your dinner
Until he ain't hungry anymore Anymore)
He wants your shimmer
To make him feel bigger
Until he starts feelin' insecure
I wish somebody would've told me the truth
Say, He's never gonna know what to do
With a woman like you
With a woman like you
With a woman like you and me""
He likes what he sees"
​star-crossed,Kacey Musgraves,star-crossed,"{'year': 2021, 'month': 8, 'day': 23}","Ooh, ooh
Ooh, ooh
Ooh, ooh
Ooh, ooh

Let me set the scene
Two lovers ripped right at the seams
They woke up from the perfect dream
And then the darkness came
I signed the papers yesterday
You came and took your things away
I moved out of the home we made
And gave you back your name

What have we done?
Did we fly too high just to get burned by the sun?
No one's to blame
'Cause we called all the angels to save us
Called them by name
But I guess they got lost
Starcrossed

Starcrossed, starcrossed, starcrossed, starcrossed)
Starcrossed, starcrossed, starcrossed, starcrossed)
Starcrossed, starcrossed, starcrossed, starcrossed)
Starcrossed, starcrossed, starcrossed, starcrossed)
Starcrossed, ah
Ah, starcrossed
Starcrossed, ah
Starcrossed
Starcrossed
Starcrossed$"
Mother,Kacey Musgraves,Golden Hour,"{'year': 2018, 'month': 3, 'day': 30}","Bursting with empathy
I'm feeling everything
The weight of the world on my shoulders
Hope my tears don't freak you out
They're just kinda coming out
It's the music in me and all of the colors

Wish we didn't live
Wish we didn't live so far from each other
I'm just sitting here
Thinking 'bout the time that's slipping
And missing my mother
Mother
And she's probably sitting there
Thinking 'bout the time that's slipping
And missing her mother
Mother$"
All Is Found (Kacey Musgraves Version),Kacey Musgraves,Холодное сердце 2 (Оригинальный саундтрек / Делюкс версия) (Frozen 2 Russian Original Motion Picture Soundtrack Deluxe),"{'year': 2019, 'month': 11, 'day': 15}","Where the north wind meets the sea
There's a river full of memory
Sleep, my darling, safe and sound
For in this river all is found
All is found
When all is lost, then all is found

In her waters, deep and true
Lie the answers and a path for you
Dive down deep into her sound
But not too far or you'll be drowned

She will sing to those who'll hear
And in her song, all magic flows
But can you brave what you most fear?
Can you face what the river knows?

Until the river's finally crossed
You'll never feel the solid ground
You had to get a little lost
On your way to being found

Where the north wind meets the sea
There's a mother full of memory
Come, my darling, homeward bound
Where all is lost, then all is found

All is found
All is found"
Biscuits,Kacey Musgraves,Pageant Material,"{'year': 2015, 'month': 3, 'day': 16}","Taking down your neighbor won't take you any higher
I burned my own damn finger poking someone else's fire
I've never gotten taller making someone else feel small
If you ain't got nothing nice to say, don't say nothing at all

Just hoe your own row and raise your own babies
Smoke your own smoke and grow your own daisies
Mend your own fences and own your own crazy
Mind your own biscuits and life will be gravy
Mind your own biscuits and life will be gravy

Nobody's perfect, we've all lost and we've all lied
Most of us have cheated, the rest of us have tried
The holiest of holies even slip from time to time
We've all got dirty laundry hanging on the line

So hoe your own row and raise your own babies
Smoke your own smoke and grow your own daisies
Mend your own fences and own your own crazy
Mind your own biscuits and life will be gravy
Mind your own biscuits and life will be gravy

Pouring salt in my sugar won't make yours any sweeter
Pissing in my yard ain't gonna make yours any greener
And I wouldn't know about the rocks in your shoes
So I'll just do me and, honey, you can just do you
So, row)

So hoe your own row and raise your own babies
Smoke your own smoke and grow your own daisies
Mend your own fences and own your own crazy
Mind your own biscuits and life will be gravy
Mind your own biscuits and life will be gravy"
​good wife,Kacey Musgraves,star-crossed,"{'year': 2021, 'month': 9, 'day': 10}","Let's go back to the beginning
I just wanna be a good wife

Wake him up nice and slow, bring coffee in bed
Listen to his problems, tell him that I understand
Touch him so he knows in his heart he's the only one
Try to loosen up and be more fun, yeah, I could be more fun

God, help me be a good wife
'Cause he needs me
Even when he's not right
He still needs me

Help me let go of all the things that make me mad
At the еnd of the day, he's gotta know that I've got his back
And if hе comes home stressed out, I could pack him a bowl
Just let him be himself, don't try to control

God, help me be a good wife
'Cause he needs me
And even when he's not right
Yeah, he still needs me

And the truth is
I could probably make it on my own
But without him
This house just wouldn't be a home
And I don't wanna be alone

God, help me be a good wife
Yeah, 'cause he needs me, oh
And even when he's not right
I know he still needs me
Help me be a good wife
'Cause I need him, ooh
And I know, I know, I know
Yeah, I know, I know, I know that I need him

Help me be a good wife
I just wanna be a good wife"
​cherry blossom,Kacey Musgraves,star-crossed,"{'year': 2021, 'month': 9, 'day': 10}","Early April, you walked up to me
Changing colors on city streets
Petals surrounding us in every shade of pink
We happened quickly, as humans do
Summer was coming and change was, too
Look at me now, I'm falling at your feet

I'm your cherry blossom, baby
Don't let me blow away
I hope you haven't forgotten
Tokyo wasn't built in a day
I'm your cherry blossom, baby
I don't wanna blow away

When we're on fire, it's something to see
No one can question the chemistry
Even in nature, timing is everything

I'm your cherry blossom, baby
Don't let me blow away
I hope you haven't forgotten
Tokyo wasn't built in a day
Yeah, I'm your cherry blossom, baby
I don't wanna blow away
Away
Away

I'm your cherry blossom, baby
Don't let mе blow away
I hope you haven't forgotten
Tokyo wasn't built in a day
I'm your chеrry blossom, baby
Don't wanna blow away
Away
Away
Away
Away
Away
Away"
