,Artist,Album,Release Date,Lyrics
Late to the Party,Kacey Musgraves,Pageant Material,"{'year': 2015, 'month': 6, 'day': 23}","They're blowing up our phones, asking where we are
Just say we're almost there; we ain't even in the car
You're rolling one for two and I'm still picking out my shoes
I'm never late to the party if I'm late to the party with you

By the time we get there, everybody will be drunk
The chairs will be on tables and the band will be unplugged
We're gonna look real good, but we're gonna look real rude
I'm sorry I'm not sorry that I'm...

Late to the party with you
Oh, who needs confetti?
We're already falling into the groove
And who needs a crowd when you're happy at a party for two?
The world can wait
'Cause I'm never late to the party if I'm late to the party with you

Let's promise when we get in that we'll try to get right out
Fake a couple conversations, make the necessary rounds
These kinda things just turn into Who's leaving here with who?""
But I just want 'em all to see me come in...

Late to the party with you
Oh, who needs confetti?
We're already falling into the groove
And who needs a crowd when you're happy at a party for two?
The world can wait
'Cause I'm never late to the party if I'm late to the party with you

Late to the party with you
Oh, who needs confetti?
We're already falling into the groove
And who needs a crowd when you're happy at a party for two?
The world can wait
'Cause I'm never late to the party if I'm late to the party with you
No, I'm never late to the party if I'm late to the party with you"
Pageant Material,Kacey Musgraves,Pageant Material,"{'year': 2015, 'month': 6, 'day': 23}","There's certain things you're s'posed to know
When you're a girl who grows up in the south
I try to use my common sense
But my foot always ends up in my mouth
And if I had to walk a runway in high heels in front of the whole town
I'd fall down
And my mama cried
When she realized

I ain't pageant material
I'm always higher than my hair
And it ain't that I don't care about world peace
But I don't see how I can fix it in a swimsuit on a stage
I ain't exactly Ms. Congenial
Sometimes I talk before I think, I've tried to fake it but I can't
I'd rather lose for what I am than win for what I ain't

God bless the girls who smile and hug
When they're called out as a runner up on TV
I wish I could, but I just can't
Wear a smile when a smile ain't what I'm feelin'
And who's to say I'm a .
Or a . if you don't even know me
Life ain't always roses and pantyhose
And...

I ain't pageant material
I'm always higher than my hair
And it ain't that I don't care about world peace
But I don't see how I can fix it in a swimsuit on a stage
I ain't exactly Ms. Congenial
Sometimes I talk before I think, I've tried to fake it but I can't
I'd rather lose for what I am than win for what I ain't


I ain't pageant material
The only crown is in my glass
They won't be handin' me a sash
And that's okay, cause there's no way
You'll ever see me in a swimsuit on a stage
I ain't exactly Ms. Congenial
Sometimes I talk before I think, I've tried to fake it but I can't
I'd rather lose for what I am than win for what I ain't
Yeah I'd rather lose for what I am than win for what I ain't"
Sway,Kacey Musgraves,Deeper Well,"{'year': 2024, 'month': 3, 'day': 15}","When the wind blows, it can push you around, it can shake you
Maybe you can show me 'cause it seems like you know how to not let it faze you
If I didn't wanna take control, I could let go

Maybe one day
I'll learn how to sway

Most of the time, all the thoughts in my mind keep me runnin'
Show me a place where I can just think of nothin'
If I surrender, if I let go, will you hold me?

Maybe one day
I'll learn how to sway
Like a palm tree in the wind
I won't break, I'll just bend
And I'll sway
I'll sway

Ahah)
I'll sway
I'll sway Yeah, oh yeah)
Like a palm tree in the wind
I won't break, I'll just bend
And I'll sway
I'll sway

Ahah)
I'll sway Yeah, oh yeah)
Ahah)
I'll sway Yeah, oh yeah)"
​there is a light,Kacey Musgraves,star-crossed,"{'year': 2021, 'month': 9, 'day': 10}","There is a light at the end of the tunnel
There is a light inside of me

Tried not to show it
To make you feel good
Pretended I couldn't
When you knew that I could

I won't cry when the cold wind blows
Gonna let it shine 'cause now I know

There is a light at the end of the tunnel
There is a light inside of me
There was a shadow of a doubt
But, baby, it's never going out
There is a light inside of me
There is a light

There is a light, it's so bright
But I've been hiding it
There is a light inside of me
There is a light

There is a light inside of me, uhhuh
There is a light inside
There is a light
Oh, there is a light, oh
There is a light
There is a light inside of me, uhhuh
There is a light inside
There is a light
There is a light inside of me, uhhuh
There is a light inside"
It Is What It Is,Kacey Musgraves,Same Trailer Different Park,"{'year': 2013, 'month': 3, 'day': 19}","I think we're thinking too hard
So put on your shoes and get in your car
Put it in drive, point it this way
We don't have to talk, you don't have to stay

But I ain't got no one sleepin' with me
And you ain't got nowhere that you need to be
Maybe I love you, maybe I'm just kind of bored
It is what it is, 'til it ain't anymore

We've tried being apart
But the truth is we are who we are
We're so much alike, it ain't a good thing
Too dumb to give up, too stubborn to change

But I ain't got no one sleepin' with me
And you ain't got nowhere that you need to be
Maybe I love you, maybe I'm just kind of bored
It is what it is, 'til it ain't anymore


'Til something better comes along
'Til whatever we have is gone

But I ain't got no one sleepin' with me
And you ain't got nowhere that you need to be
Maybe I love you, maybe I'm just kind of bored
It is what it is, 'til it ain't anymore
Yeah, it is what it is, 'til it ain't anymore"
Somebody to Love,Kacey Musgraves,Pageant Material,"{'year': 2015, 'month': 6, 'day': 23}","We're all hoping, we're all hopeless
We're all thorns and we're all roses
We're all looking down our noses at ourselves
We're all flawed and we're all perfect
We're all lost and we're all hurting
And just searching for somebody to love

We're all liars, we're all legends
We're all tens that want elevens
We're all trying to get to heaven, but not today
We're all happy, we're all hatin'
We're all patiently impatient
And just waiting for somebody to love

We're all good, but we ain't angels
We all sin, but we ain't devils
We're all pots and we're all kettles
But we can't see it in ourselves
We're all livin' 'til we're dying
We ain't cool, but man, we're trying
Just thinking we'll be fixed by someone else

We all wrangle with religion
We all talk, but we don't listen
We're all starving for attention, then we run
We're all paper, we're all scissors
We're all fightin' with our mirrors
Scared we'll never find somebody to love

We're all good, but we ain't angels
We all sin, but we ain't devils
We're all pots and we're all kettles
But we can't see it in ourselves
We're all livin' 'til we're dying
We ain't cool, but man, we're trying
Thinking we'll be fixed by someone else

Just tryin' to hold it all together
We all wish our best was better
Just hopin' that forever's really real
We'll miss a dime to grab a nickel
Overcomplicate the simple
We're all little kids just looking for love
Yeah, don't we all just want somebody to love?"
​keep lookin’ up,Kacey Musgraves,star-crossed,"{'year': 2021, 'month': 9, 'day': 10}","Grew up in the sticks where there ain't no light
But the stars were big and bright
If they told me no
I would always wonder why
But I tried to be good and keep my head down
But there was too much sky around

And my daddy said, Keep lookin' up
Don't let the world bring you down
Keep your head in the clouds
And your feet on the ground""

Keep lookin' up
Keep lookin' up

They come to me in different ways
Beautiful and strange
I've seen fire burning in the sky
Things that I can't explain
I've seen truth step into the light
And true love turn into pain

But I keep lookin' up
Won't let the world bring me down
Keep your head in thе clouds
And your feet on the ground

Keep lookin' up
Keep lookin' up
Keep lookin' up
Keep lookin' up

Ah)
Ah)
You never know what you may find
I'vе seen strange things happen all the time

Keep lookin' up
Keep lookin' up
Oh, keep lookin' up
Keep lookin' up
Keep lookin' up"
Glittery (From The Kacey Musgraves Christmas Show),Kacey Musgraves,The Kacey Musgraves Christmas Show,"{'year': 2019, 'month': 11, 'day': 29}","You shake me up and turn me upside down
Just like a snow globe
And every time you touch me
I shiver right down to my toes
You got a strange effect on me
You know you make me feel so

Glittery
You light me up like starlight on a Christmas tree
Every single kiss is like a gift to me
And I love the way you decorate my heart

Outside it's coming down
But here inside, it's warming up so
When you take your time
You turn me on and make my life glow
You got a strange effect on me
You make me feel so

Glittery
You light me up like starlight on a Christmas tree
Every single kiss is like a gift to me
And I love the way you decorate my heart

The winter is so gray, feels like the ice is here to stay
But when you look at me, you know you melt it all away

Every single kiss is like a gift to me
And I love the way you decorate my heart
Oh, so glittery
I love the way you decorate my heart"
Moving Out,Kacey Musgraves,Deeper Well,"{'year': 2024, 'month': 3, 'day': 15}","Four walls and so much space
Was way more than just a place
Wasn't it, babe?
A bedroom where you pulled me in
I found out love could start again
Start again

And that big tree in the front yard lost a limb
It almost crushed your car, but it didn't
Yeah, we kept livin' in the house
Plantin' roses all around
Leavin' it better than we found it
Now autumn's movin' in

And we're movin' out
Mm

Remember I still wore that dress
The Christmas that we all got sick
And partied anyway?
I had a breakup and then I bought it
You always said it might be haunted
And I think you're right

A couple of real big fights that we had
I cried, but it was hard to stay mad
We had good timеs, can't deny it
And even though I feel еxcited
I'm kinda sad we're leavin'
Now that autumn's movin' in

And we're movin' out
We're movin' out
Mm"
Jade Green,Kacey Musgraves,Deeper Well,"{'year': 2024, 'month': 3, 'day': 15}","I wanna bathe in the moonlight
Until I'm fully charged
Come into my power
And heal the broken parts
That I carry
Mm

Like the bracelet that you bought me
I want you on my arm
Calm, cool and protected
And keeping me from harm

Jade green
Jade green
I always keep it on me
Always keep it on me

I can't help it, I get anxious
And every time we part
I say a little prayer
To drive away the dark
And I'm with you and you're with me
Like the bracelet that you gave me

Jade green
Jade green
I always keep it on me
Always keep it on me
On me
On me On me)
Mm, on me"
Nothing to be Scared Of,Kacey Musgraves,Deeper Well,"{'year': 2024, 'month': 3, 'day': 15}","Livin' on the west side and
I think about you often
Worryin' that I might drive
The nail into the coffin
I've got my own patterns
Maybe, I can stop them

Holdin' tight to who you are
Like someone's gonna take it
Bubble wrap around your heart
Like someone's gonna break it
Demons in your mirror
Together, we'll escape them

Come to me and drop your bags
And I'll help you unpack them
You're the only one I want to give my love
There's nothing to be scared of

I madе a list of everything
That I've been busy chasin'
But if a train is mеant for me
It won't leave the station
And pull away

I'll come to you and drop my bags
And you'll help me unpack them
You say I'm the only one you wanna give your love
There's nothing to be scared of

Nothing to be scared of
Nothing to be scared of"
Lonely Millionaire,Kacey Musgraves,Deeper Well,"{'year': 2024, 'month': 3, 'day': 15}","You can step off a plane into a black car
You can pay 'em to wait
You can wear the gold watch on your wrist
But it won't give you back the moments you miss

When I get paid, I wanna spend it on you
And baby, that's what it's for
I'd burn it all to keep you warm

Who wants to be a lonely millionaire?
Comin' home, ain't no one there
That you can talk to in your kingsized bed
Be careful what you wish for, I see it all the time
The money and the diamonds and the things that shine
Can't buy you true happiness

La, la, la, la, la, la, la, la
La, la, la, la
La, la, la, la, la, la, la, la
La, la, la, la

All I want, all I want
All that I want is you
All I want, all I want
All that I want is you
Oh, mm

Be careful what you wish for, I see it all the time
The money and the diamonds and the things that shine
Can't buy you true happiness

Oh, mm
La, la, la, la, la, la, la, la
La, la, la, la
Mm"
Heaven Is,Kacey Musgraves,Deeper Well,"{'year': 2024, 'month': 3, 'day': 15}","We spent all day where the north wind blows
And you bought me a lavender rose
Put it in water when we got home
That's what heaven is

No tears to cry and nothing to mourn
Wearin' your shirt, so tattered and torn
Lyin' in your arms, so safe and warm
That's what heaven is

I don't care for money or fame
All for you, I'd give it away
The way you sound when you call my name
That's what heaven is


Nobody knows where we go when we die
Maybe we'll ride white horses in thе sky
And if we don't then, darling, tonight
That's what heavеn is

If all I have is the light in your eyes
That's what heaven is"
High Time,Kacey Musgraves,Pageant Material,"{'year': 2015, 'month': 6, 'day': 23}","It's high time to slow my roll
Let the grass just grow and lean way back
And it's a fine time to let it all go
I've been too low, so it's high time

Been missing my roots
I'm getting rid of the flash
Nobody needs a thousanddollar suit
Just to take out the trash
Ain't gotta be alone to feel lonely
I'm gonna turn off my phone
Start catching up with the old me

It's high time to slow my roll
Let the grass just grow and lean way back
And it's a fine time to let it all go
I've been too low, so it's high time

Been all wrong
Just wanna feel alright
Tomorrow might come crashing down
But for tonight

It's high time to slow my roll
Let the grass just grow and lean way back
And it's a fine time to let it all go
I've been too low, so it's high time

I'm gonna let it all go
I've been too low, so it's high time"
Cup of Tea,Kacey Musgraves,Pageant Material,"{'year': 2015, 'month': 6, 'day': 23}","Maybe your jacket is a handme down
Maybe you slept with half of your hometown
In a world of squares maybe you're just round

You can't be everybody's cup of tea
Some like the bitter, some the sweet
Nobody's everybody's favorite, so you might as well just make it how you please
'Cause you can't be everybody's cup of tea

Maybe you're working at a hotel bar
Maybe you're still driving your high school car
Maybe you still don't know just who you are

You can't be everybody's cup of tea
Some like the bitter, some the sweet
Nobody's everybody's favorite, so you might as well just make it how you please

Oh, maybe you married the wrong person first
Maybe your hair's way too long
Your sister's in jail
Or maybe you failed out of college
But, hey, life goes on
And we've all got the right to be wrong

'Cause you can't be everybody's cup of tea
Some like it black, some like it green
Nobody's everybody's favorite
So you might as well just make it how you please
'Cause you can't be everybody's cup of tea
Why would you wanna be?"
Heart of the Woods,Kacey Musgraves,Deeper Well,"{'year': 2024, 'month': 3, 'day': 15}","Under the ground, there's a neighborhood that can't be seen
Communicating through the roots of the trees
And up in the trees, there are voices that are echoing
A million different languages, songs we sing

It's in our nature to look out for each other
In the heart of the woods, mm
When there is danger, we'll take care of each other
In the heart of the woods The woods), mm

Ooh
Ooh

It's in our nature to look out for each other
In the hеart of the woods, mm
When therе is danger, we'll take care of each other
In the heart of the woods Heart of the woods), mm

Mm
Heart of the woods$"
Silver Lining,Kacey Musgraves,Same Trailer Different Park,"{'year': 2013, 'month': 3, 'day': 19}","Woke up on the wrong side of rock bottom
You're all out of pennies, and the well, it done run dry
You'd light 'em up and smoke 'em if you had 'em, but you just ain't got 'em
Yeah, ain't we always lookin' for a bluer sky?

But if you're ever gonna find a silver lining
It's gotta be a cloudy day
It's gotta be a cloudy day
If you wanna fill your bottle up with lightning
You're gonna have to stand in the rain
You're gonna have to stand in the rain

Hoohoohoo
Hoohoohoo
Hoohoohoo
Hoo

Lemonade keeps turnin' into lemons
And you wear your heart on a ripped, unraveled sleeve
Been run through the wringer and pushed plum to your limit
You say you're just unlucky, but luck ain't what you need

'Cause if you're ever gonna find a fourleaf clover
You gotta get a little dirt on your hands
You gotta get a little dirt on your hands
And if you wanna find a head that fits your shoulder
You're gonna have to go to the dance
You're gonna have to go to the dance

If you wanna find the honey
You can't be scared of the bees
And if you wanna see the forest
You're gonna have to look past the trees

If you're ever gonna find a silver lining
It's gotta be a cloudy day
Yeah, it's gotta be a cloudy day
Ooh, and if you wanna fill your bottle up with lightning
You're gonna have to stand in the rain
You're gonna have to stand in the rain

Hoohoohoo
Hoohoohoo
Hoohoohoo
Ooh, yeah
Hoohoohoo
Hoohoohoo
Hoohoohoo
Ooh, ooh, ooh"
Good Ol’ Boys Club,Kacey Musgraves,Pageant Material,"{'year': 2015, 'month': 6, 'day': 23}","I don't need a membership to validate
The hard work I've put in and the dues I've paid
Never been too good at just goin' along
I guess I've always kinda been for the underdog

Favors for friends will get you in and get you far
Shouldn't be about who it is you know
But about how good you are

Don't wanna be part of the good ol' boys club
Cigars and handshakes, appreciate you, but no, thanks
Another gear in a big machine don't sound like fun to me
Don't wanna be part of the good ol' boys club

There's a million ways to dream and that's just fine
Oh, but I ain't losin' any sleep at night
And if I end up goin' down in flames
Well, at least I know I did it my own way
Hey, hey, ey, ey

Don't wanna be part of the good ol' boys club
Cigars and handshakes, appreciate you, but no, thanks
Another gear in a big machine don't sound like fun to me
I don't wanna be part of the good ol' boys club

Favors for friends will get you in and they'll get you far
But when did it become about who you know
And not about how good you are?

Don't wanna be part of the good ol' boys club
Cigars and handshakes, appreciate you, but no, thanks
Another gear in a big machine don't sound like fun to me
I don't wanna be part of the good ol' boys club
I don't wanna be part of your good ol' boys club"
Miserable,Kacey Musgraves,Pageant Material,"{'year': 2015, 'month': 6, 'day': 23}","Your heart's as heavy as the stones you throw
Can't see the flowers for the weeds you grow
You blow your bubbles just to watch 'em burst
For you it's always bad to worse

And you... can't win unless you lose
You try to tell me you want happiness
But you ain't happy unless
You're miserable

Your neighbor's dirty laundry's cleaner
And the wolf at your door's always meaner
Your sky's still grey when the sun's around
But you can't set sail with your anchor down

And you... can't win unless you lose
You try to tell me you want happiness
But you ain't happy unless
You're miserable
I'm miserable

Can't laugh enough for the both of us
Be half enough for the whole of us
If misery loves company
Then I can't keep you company no more
You
You
You

You... can't win unless you lose
You try to tell me you want happiness
But you ain't happy unless
You're miserable"
I Miss You,Kacey Musgraves,Same Trailer Different Park,"{'year': 2013, 'month': 3, 'day': 19}","Oh my God, it's you
I never thought I'd see you here
Looks like all is well
Like you're having a hell of a good time
Me? I'm not gonna lie

Got the sunshine on my shoulders
Got a fistful of fourleaf clovers
Yeah, my cup runneth over
My sky is blue
Been kissed by Lady Luck
The stars are all lined up
Every arrow that I aim is true
But I miss you

You can't have your cake and eat it too
I should have known
'Cause what good is good anyway?
And havin' it all is just a state of mind
And I, I got no reason to cry

Got the sunshine on my shoulders
Got a fistful of fourleaf clovers
Yeah, my cup runneth over
My sky is blue
Been kissed by Lady Luck
The stars are all lined up
Every arrow that I aim is true
But I miss you

Been kissed by Lady Luck
The stars are all lined up
Every arrow that I aim is true
I got a big smile on my face
It's the best one I can fake
I'm as happy as half a heart can do
But I miss you"
This Town,Kacey Musgraves,Pageant Material,"{'year': 2015, 'month': 6, 'day': 23}","We had a girl that came in with a drug overdose the other day. And she got real belligerent. And she bit one of the nurses. Oh man). And, I mean, she bit Ohhh)you could see every tooth Nooo! Hehe). It took two or three of us to get her off of her. It's a crazy Wednesday

We finally got a flashing light
They put it in last year
And everybody got real happy
When the grocery store got beer
And last time the census men came aknockin'
We were busting at the seams

Aww, but don't you forget it, as big as we're getting
This town's too small to be mean

Big enough for a ZIP code
A VFW
A good Mexican restaurant
A beauty shop or two
Got a Methodist, a Baptist
And a Church of the Nazarene

Aww, but don't you forget it, as big as we're getting
This town's too small to be mean
Yeah, it's too dang small to be mean

Too small to be lying
Way too small to cheat
Way too small for secrets
'Cause they're way too hard to keep
And somebody's mama knows somebody's cousin
And somebody's sister knows somebody's husband
And somebody's daughter knows somebody's brother
And around here, we all look out for each other

You'll end up in the paper
Wreck your family name
What goes around comes back around
By Friday's football game
We only got one sheriff
But we all know how to keep the peace

Aww, and don't you forget it, as big as we're getting
This town's too small to be mean

Too small to be lying
Way too small to cheat
Way too small for secrets
'Cause they're way too hard to keep
And somebody's mama knows somebody's cousin
And somebody's sister knows somebody's husband
And somebody's daughter knows somebody's brother
And around here, we all look out for each other
Yeah, somebody's mama knows somebody's cousin
And somebody's sister knows somebody's husband
And somebody's daughter knows somebody's brother
And around here, we all look out for each other"
Die Fun,Kacey Musgraves,Pageant Material,"{'year': 2015, 'month': 6, 'day': 23}","Do we really have to grow up?
If we never do, then so what?
So what if I don't wanna, what if I'm just gonna
Stay drunk on all the years that I just wish would slow up?

We can't do it over
They say it's now or never and all we're ever gettin' is older
Before we get to heaven, baby, let's give 'em hell
We might as well
'Cause we don't know when we're done
So let's love hard, live fast, die fun

Let's put a little more in your glass
Walk around and spend all our cash
Just let me grab my poncho, I don't care where we go
If we speak the language you know we don't even have to come back

We can't do it over
They say it's now or never and all we're ever gettin' is older
Before we get to heaven, baby, let's give 'em hell
We might as well
'Cause we don't know when we're done
So let's love hard, live fast, die fun

We can't do it over
They say it's now or never and all we're ever gettin' is older
Before we get to heaven, baby, let's give 'em hell
We might as well
'Cause we don't know when it's done
So let's love hard
Let's stay young
Let's love hard, live fast, die fun
Die fun
We can't do it over"
Blowin’ Smoke,Kacey Musgraves,Same Trailer Different Park,"{'year': 2013, 'month': 4, 'day': 1}","Between the lunch and dinner rush
Kelly caught that outbound bus for Vegas
And we're all out here talking trash, making bets
Lips wrapped 'round our cigarettes
She always thought she was too good to be a waitress

Well, we all say that we'll quit someday
When our ship comes in, we'll just sail away

But we're just blowin' smoke
Hey, yeah
We're just blowin' smoke
Hey, yeah
Out here goin' broke
Hey, yeah
Yeah, we're just blowin' smoke

Well, Janie got divorced again
Her exhusband's in the pen
For two to five or five to ten longer, ha
And Brenda's traded smokes for cake
Still hadn't lost that baby weight
And that baby's 'bout to graduate from college

I just flick an ash into the tray
And tell them both it'll be okay

But I'm just blowin' smoke
Hey, yeah
I'm just blowin' smoke
Hey, yeah) Hey, yeah
I'm out here goin' broke
Hey, yeah
Yeah, we're just blowin' smoke

We all say that we'll quit someday
When our nerves ain't shot
And our hands don't shake, yeah
We all say that we'll quit someday
When our nerves ain't shot
And our hands don't shake

Wipe down the bar, take out the trash
Light one up and count my cash
Swear I'm never coming back again
I'm just blowin' smoke
Hey, yeah
I'm just blowin' smoke
Hey, yeah
Out here goin' broke
Hey, yeah
Yeah, we're just blowin' smoke"
