,Lyrics,Word Counts
Strangers Forever,"Good thing you wanna be over forever
I almost knocked on your door last night
To tell you that I wanted you to be mine
And I regret leavin’
Now you write me the perfect text
You edit carefully before you press send
Suddenly, I realize that this is the end
And it kills me completely

Thank God that my phone just died
'Cause I wanted to call so you could hear me cry
I'm all alone and for the very first time
Thеre's nothing I can say to make you change your mind

I lovе you but you wanna be somebody else's baby
You love me but you’re over it and you start to hate me
So after everything we've been through together
(Would it have been better stayin') strangers forever?

Now I'm stuck on a living room floor
I feel like my body doesn't work anymore
Got so much to do but I don't know what for
I slip into memories

Flashback to a summer night
Got your Converse wet from the rain outside
And I still thought for the rest of our lives
We would have each other
God, I miss you more than ever
But there's nothing I can say to make you change your mind

I love you but you wanna be somebody else's baby
You love me but you’re over it and you start to hate me
So after everything we've been through together
(Would it have been better stayin') strangers forever?

If I knew it would end like this
Would I take back that stairway kiss?
When did you become a stranger?
You're the one who said forever

I love you but you wanna be somebody else's baby
You love me but you’re over it and you start to hate me
So after everything we've been through together
(Would it have been better stayin') strangers forever?
(You said forever) Strangers forever","{'Good': 1, 'thing': 1, 'you': 19, 'wanna': 4, 'be': 5, 'over': 4, 'forever': 3, 'I': 17, 'almost': 1, 'knocked': 1, 'on': 2, 'your': 4, 'door': 1, 'last': 1, 'night': 2, 'To': 1, 'tell': 1, 'that': 4, 'wanted': 2, 'to': 9, 'mine': 1, 'And': 3, 'regret': 1, 'leavin’': 1, 'Now': 2, 'write': 1, 'me': 9, 'the': 6, 'perfect': 1, 'text': 1, 'You': 5, 'edit': 1, 'carefully': 1, 'before': 1, 'press': 1, 'send': 1, 'Suddenly,': 1, 'realize': 1, 'this': 2, 'is': 1, 'end': 2, 'it': 8, 'kills': 1, 'completely': 1, 'Thank': 1, 'God': 1, 'my': 2, 'phone': 1, 'just': 1, 'died': 1, ""'Cause"": 1, 'call': 1, 'so': 2, 'could': 1, 'hear': 1, 'cry': 1, ""I'm"": 2, 'all': 1, 'alone': 1, 'and': 4, 'for': 3, 'very': 1, 'first': 1, 'time': 1, ""Thеre's"": 1, 'nothing': 2, 'can': 2, 'say': 2, 'make': 2, 'change': 2, 'mind': 2, 'lovе': 1, 'but': 7, 'somebody': 3, ""else's"": 3, 'baby': 3, 'love': 5, 'you’re': 3, 'start': 3, 'hate': 3, 'So': 3, 'after': 3, 'everything': 3, ""we've"": 3, 'been': 6, 'through': 3, 'together': 3, '(Would': 3, 'have': 4, 'better': 3, ""stayin')"": 3, 'strangers': 3, 'forever?': 3, 'stuck': 1, 'a': 3, 'living': 1, 'room': 1, 'floor': 1, 'feel': 1, 'like': 3, 'body': 1, ""doesn't"": 1, 'work': 1, 'anymore': 1, 'Got': 2, 'much': 1, 'do': 1, ""don't"": 1, 'know': 1, 'what': 1, 'slip': 1, 'into': 1, 'memories': 1, 'might': 1, 'also': 1, 'Flashback': 1, 'summer': 1, 'Converse': 1, 'wet': 1, 'from': 1, 'rain': 1, 'outside': 1, 'still': 1, 'thought': 1, 'rest': 1, 'of': 1, 'our': 1, 'lives': 1, 'We': 1, 'would': 2, 'each': 1, 'other': 1, 'God,': 1, 'miss': 1, 'more': 1, 'than': 1, 'ever': 1, 'But': 1, ""there's"": 1, 'If': 1, 'knew': 1, 'Would': 1, 'take': 1, 'back': 1, 'stairway': 1, 'kiss?': 1, 'When': 1, 'did': 1, 'become': 1, 'stranger?': 1, ""You're"": 1, 'one': 1, 'who': 1, 'said': 2, '(You': 1, 'forever)': 1, 'Strangers': 1}"
Plans,"Plans, I'm gonna plan
Plans, I’m gonna plan
'lone with you babe

There's something in my drink tonight
(Baby) The room went still, the stars aligned
(Baby) I almost skipped this party
There blows my mind (Boom)
I think that you might change my life

But babe, I get antics, I’m frantic, I'm manic, it's true
But I get romantic, I panic, ecstatic over you

This is my favourite part, but wait before we start
Let me cancel all of my plans to be alone with you
I know we're moving fast, too good to let it pass
Let me cancel all of my plans to be alone with you
Cancel all of my plans to be alone with you
Cancel all of my plans to be alone with you, babe

You like the suburbs but that's fine (Where you are)
You say that you're afraid of heights (Where you are)
Come to the city babe, I'll change your mind (Where you are)
You'll learn to sleep with flashing lights (Where you)

But babe, I get antics, I’m frantic, I’m manic, it's true
But I get romantic, I panic, ecstatic over you

This is my favourite part (Best part)
But wait, before we start (Don’t stop)
Let me cancel all of my plans to be alone with you
I know we're moving fast (So fast)
Too good to let it pass (Can't rest)
Let me cancel all of my plans to be alone with you
Cancel all of my plans to be alone with you
Cancel all of my plans to be alone with you, babe
Alone with you, baby","{'Plans,': 2, ""I'm"": 2, 'gonna': 2, 'plan': 2, 'I’m': 4, ""'lone"": 1, 'with': 11, 'you': 13, 'babe': 3, ""There's"": 1, 'something': 1, 'in': 1, 'my': 13, 'drink': 1, 'tonight': 1, '(Baby)': 2, 'The': 1, 'room': 1, 'went': 1, 'still,': 1, 'the': 3, 'stars': 1, 'aligned': 1, 'I': 10, 'almost': 1, 'skipped': 1, 'this': 1, 'party': 1, 'There': 1, 'blows': 1, 'mind': 2, '(Boom)': 1, 'think': 1, 'that': 2, 'might': 2, 'change': 2, 'life': 1, 'But': 5, 'babe,': 3, 'get': 4, 'antics,': 2, 'frantic,': 2, 'manic,': 2, ""it's"": 2, 'true': 2, 'romantic,': 2, 'panic,': 2, 'ecstatic': 2, 'over': 2, 'This': 2, 'is': 2, 'favourite': 2, 'part,': 1, 'but': 2, 'wait': 1, 'before': 2, 'we': 2, 'start': 2, 'Let': 4, 'me': 4, 'cancel': 4, 'all': 8, 'of': 9, 'plans': 8, 'to': 12, 'be': 8, 'alone': 8, 'know': 2, ""we're"": 2, 'moving': 2, 'fast,': 1, 'too': 1, 'good': 2, 'let': 2, 'it': 2, 'pass': 2, 'Cancel': 4, 'you,': 3, 'You': 3, 'like': 2, 'suburbs': 1, ""that's"": 1, 'fine': 1, '(Where': 4, 'are)': 3, 'say': 1, ""you're"": 1, 'afraid': 1, 'heights': 1, 'Come': 1, 'city': 1, ""I'll"": 1, 'your': 1, ""You'll"": 1, 'learn': 1, 'sleep': 1, 'flashing': 1, 'lights': 1, 'you)': 1, 'also': 1, 'part': 1, '(Best': 1, 'part)': 1, 'wait,': 1, '(Don’t': 1, 'stop)': 1, 'fast': 1, '(So': 1, 'fast)': 1, 'Too': 1, ""(Can't"": 1, 'rest)': 1, 'Alone': 1, 'baby': 1}"
Headphones,"What's that voice? I hear it clearly now
Someone's talking to me, I recognize it completely
Who's that girl? I'm so inspired by her
And it's only eleven in the mornin', I'm sleepin' in

So I read the letter that I wrote to myself in my sleep and I know I'm okay
(Na-na-na, na-na-na, na-na-na)
I know there's a brighter day, but it's not today

These dreams I have are so insane, I try to tell you, but I can't
You wouldn't even get it even if I said it
I let the music lead the way so I can show you who I am
I put my headphones on and I play my song

I'm lyin' on the steps to the library
And I'm not thinkin' of you even though you just left me
And now I'm cryin' out of nowhere, but I'm laughing through it
('Cause I wanna hear a God every time she tries to talk to me
In the silence after sentences and the space between the tree branches)

So I read the letter that I wrote to myself in my sleep and I know I'm okay
(Na-na-na, na-na-na, na-na-na)
I know there's a brighter day, but it's not today

These dreams I have are so insane, I try to tell you, but I can't
You wouldn't even get it even if I said it
I let the music lead the way so I can show you who I am
I put my headphones on and I play my song

What is this feeling?
I put my headphones on and I play my song
I love to love you darlin' (Yeah, yeah, yeah)
What is this feeling?
I put my headphones on and I play my song","{""What's"": 1, 'that': 4, 'voice?': 1, 'I': 34, 'hear': 2, 'it': 7, 'clearly': 1, 'now': 2, ""Someone's"": 1, 'talking': 1, 'to': 9, 'me,': 1, 'recognize': 1, 'completely': 1, ""Who's"": 1, 'girl?': 1, ""I'm"": 8, 'so': 5, 'inspired': 1, 'by': 1, 'her': 1, 'And': 3, ""it's"": 3, 'only': 1, 'eleven': 1, 'in': 4, 'the': 12, ""mornin',"": 1, ""sleepin'"": 1, 'So': 2, 'read': 2, 'letter': 2, 'wrote': 2, 'myself': 2, 'my': 10, 'sleep': 2, 'and': 7, 'know': 4, 'okay': 2, '(Na-na-na,': 2, 'na-na-na,': 2, 'na-na-na)': 2, ""there's"": 2, 'a': 3, 'brighter': 2, 'day,': 2, 'but': 5, 'not': 3, 'today': 2, 'These': 2, 'dreams': 2, 'have': 2, 'are': 2, 'insane,': 2, 'try': 2, 'tell': 2, 'you,': 2, ""can't"": 2, 'You': 3, ""wouldn't"": 2, 'even': 5, 'get': 2, 'if': 2, 'said': 2, 'let': 2, 'music': 2, 'lead': 2, 'way': 2, 'can': 2, 'show': 2, 'you': 5, 'who': 2, 'am': 2, 'put': 4, 'headphones': 4, 'on': 5, 'play': 4, 'song': 4, ""lyin'"": 1, 'steps': 1, 'library': 1, ""thinkin'"": 1, 'of': 2, 'though': 1, 'just': 1, 'left': 1, 'me': 2, ""cryin'"": 1, 'out': 1, 'nowhere,': 1, 'laughing': 1, 'through': 1, ""('Cause"": 1, 'wanna': 1, 'God': 1, 'every': 1, 'time': 1, 'she': 1, 'tries': 1, 'talk': 1, 'In': 1, 'silence': 1, 'after': 1, 'sentences': 1, 'space': 1, 'between': 1, 'tree': 1, 'branches)': 1, 'might': 1, 'also': 1, 'like': 1, 'What': 2, 'is': 2, 'this': 2, 'feeling?': 2, 'love': 2, ""darlin'"": 1, '(Yeah,': 1, 'yeah,': 1, 'yeah)': 1}"
Trees,"I was walking down the street
There were no cars around, it was quiet
A peculiar type of deep magnetic silence
I haven't found the answer but I'm tryin'
(Damn, I'm on my)
I’ve been on my phone too much
I look up at the clouds, they're always movin'
And I wish that I could tell you how I'm doin'
You would know just what to say to get me through it
(Can you hear me?)

And suddenly the trees are breathin' like my lungs are too
And it occurs to me that I'm forever changed by you
Even though you're not here by my side
Maybe you've been listenin' all this time
If you're really there can you send a sign? (Send a sign)
And suddenly the trees are breathin' and I know it's you
(And I know it's you)

And everything I write and everything I do
And everyone I meet, I always look for you-ah-ah-ah-ah
Gonna call my friends to do something fun
'Cause I see you in everything when I'm in love-ah-ah-ah-ah-ah
(Everything is beautiful)

And suddenly the trees are breathin' like my lungs are too
And it occurs to me that I'm forever changed by you
Even though you're not here by my side
Maybe you've been listenin' all this time
If you're really there can you send a sign? (Send a sign)
And suddenly the trees are breathin' and I know it's you
(And I know it's you)

Everything is everything (Everything is everything and I see you in everything)
And I see you in everything (Everything is everything and I see you in everything)
Everything is everything (Everything is everything and I see you in everything)
And I see you in everything (Everything is everything and I see you in everything)
Everything is everything (Everything is everything and I see you in everything)
And I see you in everything (Everything is everything and I see you in everything)","{'I': 23, 'was': 2, 'walking': 1, 'down': 1, 'the': 7, 'street': 1, 'There': 1, 'were': 1, 'no': 1, 'cars': 1, 'around,': 1, 'it': 4, 'quiet': 1, 'A': 1, 'peculiar': 1, 'type': 1, 'of': 1, 'deep': 1, 'magnetic': 1, 'silence': 1, ""haven't"": 1, 'found': 1, 'answer': 1, 'but': 1, ""I'm"": 6, ""tryin'"": 1, '(Damn,': 1, 'on': 2, 'my)': 1, 'I’ve': 1, 'been': 3, 'my': 6, 'phone': 1, 'too': 3, 'much': 1, 'look': 2, 'up': 1, 'at': 1, 'clouds,': 1, ""they're"": 1, 'always': 2, ""movin'"": 1, 'And': 12, 'wish': 1, 'that': 3, 'could': 1, 'tell': 1, 'you': 18, 'how': 1, ""doin'"": 1, 'You': 2, 'would': 1, 'know': 5, 'just': 1, 'what': 1, 'to': 5, 'say': 1, 'get': 1, 'me': 3, 'through': 1, '(Can': 1, 'hear': 1, 'me?)': 1, 'suddenly': 4, 'trees': 4, 'are': 6, ""breathin'"": 4, 'like': 3, 'lungs': 2, 'occurs': 2, 'forever': 2, 'changed': 2, 'by': 4, 'Even': 2, 'though': 2, ""you're"": 4, 'not': 2, 'here': 2, 'side': 2, 'Maybe': 2, ""you've"": 2, ""listenin'"": 2, 'all': 2, 'this': 2, 'time': 2, 'If': 2, 'really': 2, 'there': 2, 'can': 2, 'send': 2, 'a': 4, 'sign?': 2, '(Send': 2, 'sign)': 2, 'and': 9, ""it's"": 4, '(And': 2, 'you)': 2, 'everything': 15, 'write': 1, 'do': 2, 'everyone': 1, 'meet,': 1, 'for': 1, 'you-ah-ah-ah-ah': 1, 'Gonna': 1, 'call': 1, 'friends': 1, 'something': 1, 'fun': 1, ""'Cause"": 1, 'see': 10, 'in': 11, 'when': 1, 'love-ah-ah-ah-ah-ah': 1, '(Everything': 7, 'is': 10, 'beautiful)': 1, 'might': 1, 'also': 1, 'Everything': 3, 'everything)': 6}"
Probabilities,"Weren't we just nineteen
It was sophomore spring
Now I'm twenty-three
I'm feeling everything
Sometimes I wanna give up
But you're keeping me up
You put those blue lights on
And turn my room into a club (Ah-ah, ah, ah-ah, ah)

Probabilities
All we have is chances
I want something to believe
You tell me to shut up
And keep on dancing

Baby, don't be scared
I can tell the future's bright
Little bit of love and care
Learning how to trust your light

Play that song from high school
Class of '
We used to scream all the words
Now I know what they mean
You put your makeup on
Six flights to the roof
Wavе function collapse
When I'm looking at you

Probabilities (Ooh, baby)
All wе have is chances
I want something to believe (Ooh, baby)
You tell me to shut up
And keep on dancing

Baby, don't be scared
I can tell the future's bright (Ah, ah)
Little bit of love and care
Learning how to trust your light

Weren't we just nineteen
It was sophomore spring
Now I'm twenty-three
I'm feeling everything
Sometimes I wanna give up
But you're keeping me up
You're the reason I'm here
You're the one that I love

Ah, ah-ah, ah-ah, ah (Probabilities)
Ah, ah-ah, ah, ah, ah-ah (Probabilities)
(Probabilities)
(Probabilities)","{""Weren't"": 2, 'we': 3, 'just': 2, 'nineteen': 2, 'It': 2, 'was': 2, 'sophomore': 2, 'spring': 2, 'Now': 3, ""I'm"": 6, 'twenty-three': 2, 'feeling': 2, 'everything': 2, 'Sometimes': 2, 'I': 8, 'wanna': 2, 'give': 2, 'up': 6, 'But': 2, ""you're"": 2, 'keeping': 2, 'me': 4, 'You': 5, 'put': 2, 'those': 1, 'blue': 1, 'lights': 1, 'on': 4, 'And': 3, 'turn': 1, 'my': 1, 'room': 1, 'into': 1, 'a': 1, 'club': 1, '(Ah-ah,': 1, 'ah,': 3, 'ah-ah,': 4, 'ah)': 2, 'Probabilities': 2, 'All': 2, 'have': 2, 'is': 2, 'chances': 2, 'want': 2, 'something': 2, 'to': 8, 'believe': 2, 'tell': 4, 'shut': 2, 'keep': 2, 'dancing': 2, 'Baby,': 2, ""don't"": 2, 'be': 2, 'scared': 2, 'can': 2, 'the': 6, ""future's"": 2, 'bright': 2, 'Little': 2, 'bit': 2, 'of': 3, 'love': 3, 'and': 2, 'care': 2, 'Learning': 2, 'how': 2, 'trust': 2, 'your': 3, 'light': 2, 'Play': 1, 'that': 2, 'song': 1, 'from': 1, 'high': 1, 'school': 1, 'Class': 1, ""'"": 1, 'We': 1, 'used': 1, 'scream': 1, 'all': 1, 'words': 1, 'know': 1, 'what': 1, 'they': 1, 'mean': 1, 'makeup': 1, 'Six': 1, 'flights': 1, 'roof': 1, 'Wavе': 1, 'function': 1, 'collapse': 1, 'When': 1, 'looking': 1, 'at': 1, 'you': 1, 'might': 1, 'also': 1, 'like': 1, '(Ooh,': 2, 'baby)': 2, 'wе': 1, '(Ah,': 1, ""You're"": 2, 'reason': 1, 'here': 1, 'one': 1, 'Ah,': 2, 'ah': 1, '(Probabilities)': 4, 'ah-ah': 1}"
Wasted,"I know that you're back the way that you are
You wanna get out of town
And I know you get by
Each lie after lie slipping out of your mouth
Got a way with your words, I don't care if it hurts
I fell for the way that it sounds
I'm in love with the dark, you're the king of my heart
Made it here and I don't care how

So, I stop counting all of your lies
Numbers are too high and so am I
I'll just get wasted on them instead
They make the room dizzy and they put me to bed

You play me so great
Love's a drinking game, so let's drink what we got
You don't need a clean slate
Just say what you say and you got me locked
But, I worship your voice with your smile so coy
Pull me up and I won't look down
I love all your lies I couldn't take a goodbye
I need the dark if I wanna shine bright

So, I stop counting all of your lies
Numbers are too high and so am I
I'll just get wasted on them instead
They make the room dizzy and they put me to bed

So, you can lie and that's alright
I only need you near me and I'll be fine
I've got to say thank you, babe
For taking me to the other side

So, I stop counting all of your lies
Numbers are too high and so am I
I'll just get wasted on them instead
Make the room dizzy and they put me to bed
So, I stop counting all of your lies
Numbers are too high and so am I
I'll just get wasted on them instead
Make the room dizzy and they put me to bed","{'I': 20, 'know': 2, 'that': 3, ""you're"": 2, 'back': 1, 'the': 10, 'way': 3, 'you': 6, 'are': 5, 'You': 4, 'wanna': 2, 'get': 6, 'out': 2, 'of': 7, 'town': 1, 'And': 1, 'by': 1, 'Each': 1, 'lie': 3, 'after': 1, 'slipping': 1, 'your': 9, 'mouth': 1, 'Got': 1, 'a': 4, 'with': 3, 'words,': 1, ""don't"": 3, 'care': 2, 'if': 2, 'it': 3, 'hurts': 1, 'fell': 1, 'for': 1, 'sounds': 1, ""I'm"": 1, 'in': 1, 'love': 2, 'dark,': 1, 'king': 1, 'my': 1, 'heart': 1, 'Made': 1, 'here': 1, 'and': 13, 'how': 1, 'So,': 5, 'stop': 4, 'counting': 4, 'all': 5, 'lies': 5, 'Numbers': 4, 'too': 4, 'high': 4, 'so': 7, 'am': 4, ""I'll"": 5, 'just': 4, 'wasted': 4, 'on': 4, 'them': 4, 'instead': 4, 'They': 2, 'make': 2, 'room': 4, 'dizzy': 4, 'they': 4, 'put': 4, 'me': 9, 'to': 6, 'bed': 4, 'play': 1, 'great': 1, ""Love's"": 1, 'drinking': 1, 'game,': 1, ""let's"": 1, 'drink': 1, 'what': 2, 'we': 1, 'got': 3, 'need': 3, 'clean': 1, 'slate': 1, 'Just': 1, 'say': 3, 'locked': 1, 'But,': 1, 'worship': 1, 'voice': 1, 'smile': 1, 'coy': 1, 'Pull': 1, 'up': 1, ""won't"": 1, 'look': 1, 'down': 1, ""couldn't"": 1, 'take': 1, 'goodbye': 1, 'dark': 1, 'shine': 1, 'bright': 1, 'might': 1, 'also': 1, 'like': 1, 'can': 1, ""that's"": 1, 'alright': 1, 'only': 1, 'near': 1, 'be': 1, 'fine': 1, ""I've"": 1, 'thank': 1, 'you,': 1, 'babe': 1, 'For': 1, 'taking': 1, 'other': 1, 'side': 1, 'Make': 2}"
1,"I'm at the edge of the world that I knew
Is this the end?
Am I just passing through?
Baby, put your sneakers on
I wanna run
Baby, fuck your friends
I just wanna have fun

And I wanna get high
Higher than the sun, 
Put the anchor down
I can show you how it's done (And I wanna get high)
Higher than the sun, 
Can you feel the-

I like to shine bright like a fucking star
I like to feel amazing
And I like to feel no pain
And I like to go hard
I like to shine bright like a fucking star
I like to feel amazing
And I like to feel no pain
And I like to go hard

Okay, girl you can roll with us (You can trust me)
I got nothin' in my heart if I do not trust (You can trust me)
All that matters is you're having fun (You can trust me)
Are you havin' fun?
'Cause I'm havin' fun (Can I trust you?)

And I wanna get high
Higher than the sun, 
Put the anchor down
I can show you how it's done (And I wanna get high)
Higher than the sun, 
Can you feel the-

I like to shine bright like a fucking star
I like to feel amazing
And I like to feel no pain
And I like to go hard
I like to shine bright like a fucking star
I like to feel amazing
And I like to feel no pain
And I like to go hard

Baby, let's run

Baby, let's run
","{""I'm"": 2, 'at': 1, 'the': 9, 'edge': 1, 'of': 1, 'world': 1, 'that': 2, 'I': 29, 'knew': 1, 'Is': 1, 'this': 1, 'end?': 1, 'Am': 1, 'just': 2, 'passing': 1, 'through?': 1, 'Baby,': 4, 'put': 1, 'your': 2, 'sneakers': 1, 'on': 1, 'wanna': 6, 'run': 3, 'fuck': 1, 'friends': 1, 'have': 1, 'fun': 3, 'And': 10, 'get': 4, 'high': 2, 'Higher': 4, 'than': 4, 'sun,': 4, 'Put': 2, 'anchor': 2, 'down': 2, 'can': 6, 'show': 2, 'you': 6, 'how': 2, ""it's"": 2, 'done': 2, '(And': 2, 'high)': 2, 'Can': 2, 'feel': 10, 'the-': 2, 'like': 21, 'to': 16, 'shine': 4, 'bright': 4, 'a': 4, 'fucking': 4, 'star': 4, 'amazing': 4, 'no': 4, 'pain': 4, 'go': 4, 'hard': 4, 'You': 1, 'might': 1, 'also': 1, 'Okay,': 1, 'girl': 1, 'roll': 1, 'with': 1, 'us': 1, '(You': 3, 'trust': 5, 'me)': 3, 'got': 1, ""nothin'"": 1, 'in': 1, 'my': 1, 'heart': 1, 'if': 1, 'do': 1, 'not': 1, 'All': 1, 'matters': 1, 'is': 1, ""you're"": 1, 'having': 1, 'Are': 1, ""havin'"": 2, 'fun?': 1, ""'Cause"": 1, '(Can': 1, 'you?)': 1, ""let's"": 2}"
Twin Flame,"(My twin flame for life)

Babe, I know love is a rollercoaster
But every time we fight it just brings me closer
Move into your room so I hang a poster
And I know I haven't always been an angel
But you can trust me 'cause I'm gonna be faithful
Holding your hands underneath the table

Don't be mad, you're the only one
Don't be mad, you're the only one
My twin flame for life

Twin flame, just talk to me
Can you let me say sorry?
Love a girl with a need for speed
Party all night, but I know you get lonely
Twin flame, just talk to me
Can you lеt me say sorry?
Love a girl with a need for speed
Party all night, but I know you'll get lonеly

Stay by my side, we'll be alright
'Cause baby, you're my twin flame for life
Stay by my side, we'll be alright
'Cause baby, you're my twin flame for life

Who, me? Who, me? Yeah
Party, alright, alright
Who, me? Who, me? Yeah
Party, party, alright

Don't be mad, you're the only one (Don't me mad, you're the only one)
Don't be mad, you're the only one (Don't me mad, you're the only one)
(My twin flame for life)

Twin flame, just talk to me
Can you let me say sorry?
Love a girl with a need for speed
Party all night, but I know you get lonely
Twin flame, just talk to me
Can you let me say sorry?
Love a girl with a need for speed
Party all night, but I know you'll get lonely
Stay by my side, we'll be alright
'Cause baby, you're my twin flame for life
Stay by my side, we'll be alright
'Cause baby, you're my twin flame for life

T-W-I-N F-L-A-M-E
Don't be mad, you're the only one
The up and the down is just part of the fun
And we're still in love

Twin flame, just talk to me
Can you let me say sorry?
Love a girl with a need for speed
Party all night, but I know you get lonely (And we're still in love)
Twin flame, just talk to me
Can you let me say sorry?
Love a girl with a need for speed
Party all night, but I know you'll get lonely

Stay by my side, we'll be alright
'Cause baby, you're my twin flame for life
Stay by my side, we'll be alright
'Cause baby, you're my twin flame for life","{'(My': 2, 'twin': 9, 'flame': 9, 'for': 15, 'life)': 2, 'Babe,': 1, 'I': 10, 'know': 8, 'love': 2, 'is': 2, 'a': 14, 'rollercoaster': 1, 'But': 2, 'every': 1, 'time': 1, 'we': 1, 'fight': 1, 'it': 1, 'just': 8, 'brings': 1, 'me': 16, 'closer': 1, 'Move': 1, 'into': 1, 'your': 2, 'room': 1, 'so': 1, 'hang': 1, 'poster': 1, 'And': 2, ""haven't"": 1, 'always': 1, 'been': 1, 'an': 1, 'angel': 1, 'you': 10, 'can': 1, 'trust': 1, ""'cause"": 1, ""I'm"": 1, 'gonna': 1, 'be': 12, 'faithful': 1, 'Holding': 1, 'hands': 1, 'underneath': 1, 'the': 10, 'table': 1, ""Don't"": 5, 'mad,': 7, ""you're"": 13, 'only': 7, 'one': 5, 'My': 1, 'life': 7, 'Twin': 6, 'flame,': 6, 'talk': 6, 'to': 6, 'Can': 6, 'let': 5, 'say': 6, 'sorry?': 6, 'Love': 6, 'girl': 6, 'with': 6, 'need': 6, 'speed': 6, 'Party': 6, 'all': 6, 'night,': 6, 'but': 6, 'get': 6, 'lonely': 5, 'lеt': 1, ""you'll"": 3, 'lonеly': 1, 'You': 1, 'might': 1, 'also': 1, 'like': 1, 'Stay': 6, 'by': 6, 'my': 12, 'side,': 6, ""we'll"": 6, 'alright': 8, ""'Cause"": 6, 'baby,': 6, 'Who,': 4, 'me?': 4, 'Yeah': 2, 'Party,': 2, 'alright,': 1, 'party,': 1, ""(Don't"": 2, 'one)': 2, 'T-W-I-N': 1, 'F-L-A-M-E': 1, 'The': 1, 'up': 1, 'and': 1, 'down': 1, 'part': 1, 'of': 1, 'fun': 1, ""we're"": 2, 'still': 2, 'in': 2, '(And': 1, 'love)': 1}"
